film_title,category,plot
Son Durak: Kan Bağı,"Korku, Gizem","Eğer ""ölümün"" planlarını bozarsanız işler çok karmaşık bir hâl alabilir. Sürekli tekrar eden şiddetli bir kâbusla boğuşan üniversite öğrencisi Stefanie, bu döngüyü kırıp aile fertlerini, onları bekleyen korkunç ölümden kurtarabilecek tek kişinin izini sürmek için eve döner."
Son Damla,"Gerilim, Dram, Suç","Bardağı taşıran son damla hangisi olacak? Çalışkan bir bekâr anne, felaketlerle dolu bir gün nedeniyle dayanma sınırına ulaşınca çaresizlik içinde şaşırtıcı bir hamle yapar."
Amatör,"Gerilim, Aksiyon","Filmde Rami Malek, Charlie Heller adında zeki ancak içine kapanık bir deşifre uzmanını canlandırıyor. Langley'deki CIA merkezi binasında bodrum katındaki ofisinde çalışan Heller'ın hayatı, Londra'daki bir terörist saldırısında karısının öldürülmesinin ardından altüst olur. Yetkililerin harekete geçmeyi reddetmesi üzerine Charlie, işleri kendi eline alır ve sorumluları bulmak için tehlikeli bir yolculuğa çıkar. Zekası, peşinden koşanlardan kaçmak ve intikamını almak için en güçlü silahı olacaktır."
Ejderhanı Nasıl Eğitirsin,"Aksiyon, Aile, Fantastik","Vikingler ve ejderhaların nesiller boyu amansız düşmanlar olduğu Berk adasında Hıçkıdık farklı bir duruş sergiliyor. Vast Şefi Stoick’in yaratıcı ama göz ardı edilen oğlu Hıçkıdık, korkulan bir Gecenin Öfkesi ejderhası olan Dişsiz ile arkadaş olduğunda yüzyıllardır süregelen geleneklere meydan okur. Aralarındaki alışılmadık bağ, ejderhaların gerçek doğasını ortaya çıkararak Viking toplumunun temellerine karşı gelir. Azimli ve hırslı Astrid ve köyün tuhaf demircisi Gobber ile birlikte Hıçkıdık, korku ve yanlış anlamalarla dolu bir dünyayla yüzleşir. Hem Vikingleri hem de ejderhaları tehlikeye atan kadim bir tehdit ortaya çıkarken, Hıçkıdık’ın Dişsiz ile olan dostluğu yeni bir gelecek kurmanın anahtarı haline gelir. Birlikte, dünyalarının sınırlarının ötesine uçarak ve bir kahraman ve lider olmanın ne anlama geldiğini yeniden tanımlayarak barışa giden hassas yolda ilerlemeleri gerekir."
Predator: Killer of Killers,"Animasyon, Aksiyon, Bilim-Kurgu","Bu orijinal animasyon antolojisi, insanlık tarihinin en dişli üç savaşçısının izinden gidiyor: Genç oğlunu kanlı bir intikam yolculuğuna gönderen bir Viking akıncısı, feodal Japonya’da Samuray kardeşine karşı acımasız bir taht mücadelesine girişen bir ninja ve dünya dışı bir tehlikeyi araştırmak üzere gökyüzünü mesken tutan bir II. Dünya Savaşı pilotu"
Gizli Görev,"Aksiyon, Komedi, Suç","Gizli Görev, başarı şansını kaçırıp kaçırmadığını sorgulamaya başlayan bir doğaçlama komedi öğretmeni olan Kat rolünde Bryce Dallas Howard'ın oynadığı hızlı tempolu bir aksiyon komedi. Gizli görevdeki bir polis ona hayatının rolünü teklif edince tehlikeli suçluların kimliğine bürünerek Londra'nın çete dünyasına sızmaları için iki öğrencisini işe alır."
Hesaplaşma 2,"Gizem, Suç, Gerilim","Christian Wolff, karmaşık problemleri çözme yeteneğine sahiptir. Eski bir tanıdığı öldürülüp ""muhasebecinin bulunması"" için şifreli bir mesaj bırakınca Wolff, olayı çözmeye yardım etmesi için uzak ve oldukça ölümcül erkek kardeşi Brax'i dahil etmek zorunda kalır. ABD Hazine Müdür Yardımcısı Medina ile birlikte ölümcül bir komployu ortaya çıkarırlar ve acımasız bir katil şebekesinin hedefi olurlar."
Life After Fighting,"Aksiyon, Dram, Gerilim","Emekli dövüş sanatları dünya şampiyonu Alex Faulkner, iki öğrencisinin ortadan kaybolması, evine yakın bir yerde düşünülemez bir keşfe yol açınca basit bir hayata alıştı. Çocukları bulma umudu tamamen tükenmişken, tutuklu kızların yerini tespit eder ve uluslararası bir çocuk kaçakçılığı operasyonuyla karşı karşıya kalır; bu da onu, bu işin arkasındakilere karşı verdiği hayatının mücadelesine geri çeker."
Günahkarlar,"Korku, Gerilim, Fantastik","Sorunlu hayatlarını geride bırakmaya çalışan ikiz kardeşler yeniden başlamak için memleketlerine döner ancak daha büyük bir kötülüğün onları karşılamak için beklediğini keşfederler. ""Şeytanla dans etmeye devam edersen bir gün peşinden evine gelir."""
Bir Minecraft Filmi,"Aile, Komedi, Macera, Fantastik","Dört uyumsuz, gizemli bir portaldan aniden Üst Dünya'ya çekildiklerinde kendilerini sıradan sorunlarla boğuşurken bulurlar: hayal gücüyle beslenen tuhaf, kübik bir harikalar diyarı. Eve geri dönmek için, beklenmedik, uzman bir zanaatkar olan Steve ile büyülü bir göreve çıkarken bu dünyada ustalaşmaları gerekecektir."
Nakavt,"Aksiyon, Dram, Macera","Eski bir dövüşçü, yıllar önce kazara öldürdüğü rakibinin kayıp oğlunu bulmalıdır. Bu uğurda Marsilya'daki acımasız ve vahşi bir çeteyle karşı karşıya gelmeye hazırdır."
Mission: Impossible - Son Hesaplaşma,"Aksiyon, Macera, Gerilim","""Mission: Impossible - Ölümcül Hesaplaşma Birinci Bölüm""ün bıraktığı yerden devam ediyor. Ethan Hunt ve ekibinin, yanlış ellerde dünyanın sonunu getirebilecek bir yapay zekâ programı olan ""Varlık""a ulaşma mücadelesini anlatıyor. Ethan, bu kez sadece dünyayı kurtarmakla kalmaz, aynı zamanda geçmişteki hesaplaşmaları da sonlandırmak zorundadır."
Ballerina,"Aksiyon, Gerilim, Suç","John Wick: Bölüm 3 - Parabellum olaylarının geçtiği zaman diliminde yer alan Ballerina, Ruska Roma'nın suikastçı geleneklerinde eğitimine başlayan Eve Macarro'nun hikayesini anlatıyor."
Ağır İşçi,"Aksiyon, Suç, Gerilim","Levon Cade, eski bir Kraliyet Deniz Komandosu'dur ve artık inşaat işçisi olarak sakin bir yaşam sürmektedir. Ancak patronunun genç kızı Jenny'nin insan kaçakçıları tarafından kaçırılmasıyla birlikte, Levon eski yeteneklerini kullanmak zorunda kalır. Jenny'yi bulmak için çıktığı bu yolculuk, onu büyük bir yolsuzluk ve hükümet ajanlarının insan kaçakçılığına karıştığı bir komploya götürür."
Pamuk Prenses,"Aile, Fantastik","Güzel bir kız olan Pamuk Prenses, üvey annesi olan kötü Kraliçe'den saklanmak için ormandaki yedi cücelerin evine sığınır. Kraliçe, Pamuk Prenses'in güzelliğini kıskanır çünkü ""ülkenin en güzeli"" olarak bilinmek ister."
Echo Valley,"Gerilim, Dram","Julianne Moore, sorunlu kızı korkmuş ve başka birinin kanıyla kaplı hâlde kapısında belirince münzevi hayatının düzeni bozulan Kate'i oynar. Kate, şoke edici gerçeği öğrendiğinde çocuğu için ne kadar ileriye gidebileceğini görür."
K-Pop: İblis Avcıları,"Animasyon, Fantastik, Aksiyon, Müzik, Komedi","K-pop süperstarları Rumi, Mira ve Zoey, stadyumlarda kapalı gişe konserler vermedikleri zamanlarda hayranlarını doğaüstü bir tehditten korumak için gizli güçlerini kullanır."
Ejderhanı Nasıl Eğitirsin,"Fantastik, Macera, Animasyon, Aile","Ejderhalar Berk Adası'nı kendilerine mesken seçmişlerdir. Senelerce acımasız mahlukat tarafından yağmalanan talihsiz adanın biçare yerlileri için hayvanlarını çalıp evlerini yakan bu ejderhaları tepelemek bir nevi namus borcudur. Yetişkinlik çağına erişen genç erkeklerin yapması gereken tek şey bir ejderhayı öldürmektir. Zamanı geldiğinde köyün şefinin tuhaf oğlu Hiccup, icat ettiği tuhaf mekanizmalı silahı bir yaratığa doğrultarak onu öldürmeye yeltenir. Nadir bir türe ait olan bu ejderhayı bir türlü öldüremeyen Hiccup, hayvanı ormana götürerek serbest bırakır. Sonrasında ise aralarında sadakat ve içtenlik barındıran bir arkadaşlık gelişir."
Moana 2,"Animasyon, Macera, Aile, Komedi","Moana ve Maui'yi üç yıl sonra alışılmadık denizcilerden oluşan bir ekiple birlikte geniş kapsamlı yeni bir yolculuk için yeniden bir araya getiriyor. Yol gösterici atalarından beklenmedik bir çağrı alan Moana, daha önce karşılaşmadığı bir macera için Okyanusya'nın uzak denizlerine, tehlikeli ve uzun süredir bilinmeyen sularına yolculuk etmek zorunda."
Thunderbolts*,"Aksiyon, Bilim-Kurgu, Macera","Yelena Belova önderliğinde, MCU'nun en beklenmedik kahramanlarından oluşan aykırı bir takım bir araya geliyor. Valentina Allegra de Fontaine’in kurduğu ölümcül bir tuzağa düşen bu dışlanmış karakterler, geçmişlerinin en karanlık yönleriyle yüzleşmek zorunda kalacakları tehlikeli bir göreve çıkacaklar."
Çatışma,"Savaş, Aksiyon","Gözetim görevleri ters gidince kendilerini büyük bir tehlikenin içinde bulan ABD Özel Kuvvetler müfrezesinin yürek parçalayıcı gerçek hikâyesi. Çatışma, savaşın şiddetini benzeri görülmemiş bir şekilde yansıtıyor ve kardeşlik, fedakarlık ve hayatta kalma konularını çekincesizce ele alıyor."
Elio,"Aile, Komedi, Macera, Animasyon, Bilim-Kurgu","Aktif bir hayal gücüne sahip bir mazlum olan Elio, yanlışlıkla kendisini uzak ve geniş galaksilerden temsilcilerin bulunduğu gezegenler arası bir organizasyon olan Communiverse'e ışınlanmış halde bulur. Yanlışlıkla Dünya'nın evrenin geri kalanına elçisi olarak tanımlanan ve bu tür bir baskıya tamamen hazırlıksız olan Elio, eksantrik uzaylı yaşam formlarıyla yeni bağlar kurmalı, bir dizi zorlu sınavdan sağ çıkmalı ve bir şekilde gerçekte kim olması gerektiğini keşfetmelidir."
28 Gün Sonra,"Korku, Gerilim, Bilim-Kurgu","İngiltere'de bir genetik araştırmalar ensitüsünde insan doğasındaki şiddet ve öfkeyle ilgili bazı tehlikeli deneyler yapılmış ve bunun sonucunda 'rage' adını verdikleri bir virüs geliştirilmiştir. Bir grup aktivist, biliminsanlarının maymunlara zarar verdikleri gerekçesiyle deneylerin yapıldığı binaya sızarak korunaklı kafeslerde tutulan ve 'rage' virüsü aşılanan maymunlardan birini serbest bırakırlar. Fakat serbest kalan maymun kafesten çıkar çıkmaz eylemcilerden birine saldırır ve olaylar içinden çıkılmaz bir hal alır."
Ejderhanı Nasıl Eğitirsin 2,"Fantastik, Aksiyon, Macera, Animasyon, Komedi, Aile","Berk Adası'nda ejderha ve vikinglerin birleşmesinin üstünden beş yıl geçmiştir ve adada tam bir barış ve huzur atmosferi hakimdir. Astrid ve ekibi artık boş zamanlarını adanın yeni gözde oyunu olan ejderha yarışlarıyla geçirmekte ve kahramanlar yeni keşif gezilerine adım atmaktadırlar. Bu yolculuklardan birinde çok eski zamanlardan kalma buzdan gizli bir mağara keşfederler ve mağaranın içinde yaşayan yüzlerce vahşi ejderhayı böylece uyandırmış olurlar. Gizemli Dragon Rider'ın da büyük bir tehlike yarattığı bir savaş başladığında, iki kahramanımız Hiccup ve Toothless'a düşen barışı koruyup inandıkları şeyi savunmaları olur."
Kaptan Amerika: Cesur Yeni Dünya,"Aksiyon, Gerilim, Bilim-Kurgu","Kaptan Amerika: Cesur Yeni Dünya, Kaptan Amerika'nın maceralarını konu ediyor. Amerika Birleşik Devletleri'nin yeni Başkanı Thaddeus Ross ile tanıştıktan kısa bir süre sonra Kaptan Amerika olarak da bilinen Sam Wilson, kendisini devasa bir uluslararası olayın tam ortasında bulur. Operasyonun gerçek dehası tüm dünyayı ateşe vermeden önce Sam Wilson zamana karşı amansız bir savaşa girişir."
Şafağa Kadar,"Korku, Gizem","Kız kardeşi Melanie'nin gizemli bir şekilde kaybolmasının üzerinden bir yıl geçtikten sonra, Clover ve arkadaşları cevaplar bulmak için kız kardeşinin ortadan kaybolduğu ücra vadiye doğru yola çıkarlar. Terk edilmiş bir ziyaretçi merkezini keşfederken, maskeli bir katil tarafından takip edildiklerini ve korkunç bir şekilde teker teker öldürüldüklerini fark ederler ancak sonra uyanıp kendilerini aynı akşamın başlangıcına dönmüş olarak bulurlar."
Karate Kid: Efsane Dövüşçüler,"Aksiyon, Macera, Dram","Pekin'den New York'a taşınan genç kung fu yeteneği Li Fong'un hikâyesi anlatılıyor. Ailevi bir trajedinin ardından yeni hayatına uyum sağlamaya çalışan Li, bir arkadaşına yardım etmek için bir karate turnuvasına katılmaya karar verir. Ancak, kung fu bilgisi yeterli olmadığından, eğitmeni Bay Han, orijinal Karate Kid olan Daniel LaRusso'dan yardım ister. İkili, Li'yi hem kung fu hem de karate teknikleriyle eğiterek, onu turnuvaya hazırlar."
The Last Stand of Ellen Cole,"Aksiyon, Macera","Kötü niyetli bir müteahhit, yeni projesinin önünde engel teşkil eden hırçın bir kiracıyı evden çıkarmak için aşırı önlemlere başvurduğunda, bu görünüşte zararsız yaşlı kadının eğitimli bir katil olduğunu ve sevgili evini korumak için her şeyi yapacağını hesaba katmaz."
Kayıp Dünya,"Aksiyon, Fantastik, Macera","Bu fantastik macera, aynı adı taşıyan George R.R. Martin öykülerinden uyarlanmıştır. Bir büyücü, Kayıp Diyarlar’a doğru yolculuk eder. Amacı, bir kişinin kurt adam dönüşümüne olanak tanıyan sihirli bir gücü bulmaktır. Bu mistik hikâye, iyilik ve kötülük, borç ve tatmin, aşk ve kayıp gibi temaları keşfeder. Büyü ve yaratıklarla dolu bu dünyada, büyücü Alys ve rehberi, gezgin Boyce, insanlar ve iblislerle mücadele ederken zorlu bir yolculuğa çıkarlar. Büyülü bir dünyada gerilim ve macera dolu bir yolculuğa katılın."
Culpa Mia,"Romantik, Dram","Noah yaşadığı şehri, sevgilisini ve arkadaşlarını geride bırakıp annesinin yeni kocasının malikânesine taşınmak zorunda kalır. Orada tanıştığı yeni üvey kardeşi Nick'le karakterleri uyuşmasa da aralarındaki çekim ile asi ve sancılı mizaçları ikilinin dünyasını altüst eder ve birbirlerine sırılsıklam âşık olmalarına neden olur."
xXx,"Aksiyon, Macera, Gerilim, Suç","Xander Cage kazancını heyecan yaratan maceralarının video kayıtlarını internete satarak sağlamaktadır ve hayranları da çok fazladır. ancak yasalara uymadığından da sayısız suçu vardır. Xander 'in bilmediği ise Ulusal Güvenlik Ajansı'na bağlı deneyimli ve eski bir ajan olan Augutus Gibbons tarafından izlendiğidir.Ajan Gibbons ve Ulusal Güvenlik uzaklarda, Prag'da umutsuz bir durumla karşı karşıyadırlar. Ajansın yeraltındaki gizli ajanı kendilerine Anarşi 99 adı verilen acımasız bir çete tarafından öldürülmüştür. Ve Gibbons'un Prag'a gidecek ve yeraltına inip bu çetenin kurallarına göre oynayarak onların dünyayı yok etmek için yaptığı planları öğrenmesine ve yok etmesini sağlayacak yeni bir ajana ihtiyacı vardır.Ajan Xander Cage, kod adı XXX..."
Kirpi Sonic 3,"Aksiyon, Bilim-Kurgu, Komedi, Aile","Süpersonik hızlarda koşabilen mavi bir kirpi olan Sonic'in maceralarını konu alan bu seride, dostları Knuckles ve Tails ile birlikte, daha önce karşılaştıkları hiçbir şeye benzemeyen gizemli ve güçlü bir düşman olan Shadow'a karşı mücadele ediyor. Shadow, sahip olduğu benzersiz yeteneklerle Sonic ve arkadaşlarını zorluyor. Bu tehlikeli düşmanı durdurmak ve gezegeni korumak için Sonic ve ekibi, beklenmedik ittifaklar kurmak zorunda kalıyor."
Ejderhanı Nasıl Eğitirsin 3: Gizli Dünya,"Animasyon, Aile, Macera","Hicks, Vikinglerin ilk ejderha eğitmeni olmuş ve ejderhalar ile insanlar arasındaki barışı sağlama görevini başarıyla yerine getirmiştir. Ejderhası Dişsiz ile kazandıkları bu barış, Dişsiz'in yeni keşfi ile önemini kaybeder. Dişsiz artık tükendiğini sandığı kendi soyuna mensup bir ejderhayı keşfeder. Bu dişi ejderha vahşi ve zorludur. Tehlike bir kez daha kapıya dayandığında ve Hicks'in otoritesi sınandığında, ejderha da binici de kendi türünü korumak için önemli kararlar vermek zorunda kalacaktır."
Lilo ve Stiç,"Animasyon, Aile, Komedi","Dünya dışından gelen bir hikayeyi anlatan bu nefis Disney animasyonu, vahşi ve dayanılmaz karakterleriyle şimdi kalplerinizi fethetmeye hazırlanıyor. Sadakati, arkadaşlığın gücünü ve bu dünyada kendine bir yer bulmanın hikayesini anlatan dünya çapında gişe başarısı yakalamış kalpleri ısıtan bir komedi. Hawaii'de, adı Lilo olan evlat edinilmiş küçük yerli bir kız çocuğu, masum bir köpek yavrusu bulur. Stiç, aslında dünya dışı bir yaratıktır. Tüm ailenizle birlikte tekrar tekrar eğlenerek izleyeceğiniz macera dolu bir komedi."
Sikandar,"Aksiyon, Dram","Adaletsizlikle boğuşan bir ülkede, ateşli bir genç, güçlü bir yolsuzluk ağına karşı çıkıyor, mevcut düzeni sorguluyor ve halkın hakları için mücadele ediyor."
Bizim Zamanımızda,"Bilim-Kurgu, Romantik, Komedi",Evli çift Nora ve Héctor çığır açan bilimsel keşifleriyle zamanda yolculuk ederek 1966 yılından 2025'e gelir. Héctor bocalasa da Nora başarılıdır. Ama bunun bedeli ne olacaktır?
Mücevher Hırsızı - Soygun Başlıyor,"Aksiyon, Gerilim","Bu yüksek tempolu kurnazlık ve irade yarışında usta düzenbaz Rehan, bir elmas soygunu planlarken bir yandan da sadist hasmı Rajan'ı zekâsıyla alt etmeye çalışır."
Mufasa: Aslan Kral,"Macera, Aile, Animasyon","Mufasa, efsanesini Simba ve Nala'nın kızı aslan yavrusu Kiara'ya aktarması için Rafiki'den yardım istiyor. Geçmişe dönüşlerle anlatılan hikaye, Mufasa'yı kaybolmuş ve yalnız bir yetim yavru olarak tanıtıyor, ta ki kraliyet soyunun varisi Taka adında sempatik bir aslanla tanışana kadar. Şans eseri buluşma, kaderlerini arayan olağanüstü bir grup uyumsuzun yola koyulmasına neden oluyor. Bu grubun arasındaki bağ, tehditkar ve ölümcül bir düşmandan kaçmak için birlikte çalışmaları sonucu sınanıyor."
Tin Soldier,"Aksiyon, Gerilim","Hayatta bir yol, emniyet ve güvenlik arayanlara hitap eden The Bokushi, gazileri bir araya getirir. Bu manevi lider, iyi eğitimli eski ordu üyelerinden oluşan takipçileri nedeniyle, dünya liderlerinin hesaba katılması gereken bir güç haline gelir."
Tam Bana Göre,"Romantik, Dram","Profesyonel evlilik danışmanı Lucy, aşk hakkında her şeyi bildiğine inanmaktadır. Usta bir şekilde kalpleri birleştirirken, kendisi kararlı bir bekâr olarak kalmayı sürdürür. Ta ki, karizmatik milyoner Randy ona kur yapmaya başlayana ve yakışıklı eski sevgilisi John yeniden hayatına girinceye kadar... Lucy, gerçek aşkın hiçbir formüle ve hesaba sığmayacağını anlar."
F1,"Aksiyon, Dram","Yarış efsanesi Sonny Hayes, zor durumdaki bir Formula 1 takımına liderlik edip bir kez daha zafere ulaşma şansını kovalarken bir yandan da genç, yetenekli bir sürücüye akıl hocalığı yapmak üzere pistlere döner."
Jurassic World: Yeniden Doğuş,"Bilim-Kurgu, Macera, Aksiyon","Jurassic World: Hâkimiyet'te yaşanan olaylarından beş yıl sonrasında geçmektedir. Dünya'nın ekosistemi, dinozorlar için büyük ölçüde elverişsiz hale gelmiş ve hayatta kalanlar, bir zamanlar gelişip büyüdükleri tropikal bölgelere çekilmiştir. Zora Bennett adlı gizli operasyonlar uzmanının, insanlık için mucizevi faydalar sağlayacak bir ilacın geliştirilmesi amacıyla üç büyük dinozordan genetik materyal toplamak üzere bir ekibe liderlik ediyor. Görev sırasında, ekibin yolu bir adada mahsur kalan bir aileyle kesişir ve burada onlarca yıldır dünyadan gizlenen karanlık bir sırrı keşfederler."
Dokunulmazlık,"Gerilim, Aksiyon","Eski bir özel kuvvetler askeri olan Sara, ABD konsolosluğunda ortadan kaybolan oğlunu bulmak için elinden gelen her şeyi yapar ve karanlık bir komployu açığa çıkarır."
Vahşi Robot,"Animasyon, Bilim-Kurgu, Aile","Bu destansı macera, ıssız bir adaya düşen ve zorlu çevre koşullarına uyum sağlamayı öğrenmesi gereken bir robotun -ROZZUM ünite 7134’ün, kısaca “Roz”un- yavaş yavaş adadaki hayvanlarla ilişki kurmasını ve yetim bir kaz yavrusunun evlat edinmesini konu alıyor."
The Gorge,"Romantik, Bilim-Kurgu, Gerilim","Yüksek eğitimli iki ajan, gizemli bir vadinin iki tarafını korumak için gönderildikten sonra yakınlaşırlar. Vadideki kötülük ortaya çıktığında sağ kurtulmak için birlikte çalışmak zorundadırlar."
The Monkey,"Korku, Komedi","İkiz kardeşler Hal ve Bill, çocukluklarında karşılaştıkları lanetli bir oyuncak maymunun peşlerini bırakmadığını keşfederler. Oyuncak maymun, onu eline geçiren her kişiye dehşet ve ölüm getirirken, kardeşler hem geçmişlerinin karanlık sırlarıyla hem de bu uğursuz mirasla yüzleşmek zorundadır. Yıllar sonra tekrar bir araya geldiklerinde, masum bir çocuğun hayatını kurtarmak için bu laneti durdurmaya çalışırlar."
Brave Citizen,"Aksiyon, Dram, Komedi","Kahraman So Si Min’in hikayesi, liseli sporcu olarak üst düzey hapkido becerileriyle ülkede tanındığı dönemi anlatıyor. Yedi yıl sonra, yarı zamanlı bir öğretmen olarak hayatına devam ederken, So Si Min birden bire kötü şöhreti olan öğrenci Han Soo Kang’ın hedefi haline gelir."
Ters Yüz 2,"Animasyon, Macera, Komedi, Aile","Disney ve Pixar'ın ""Ters Yüz 2"" filminde, ergenliğe adım atan Riley'nin zihnine döneriz. Merkez'de aniden bir tadilat başlar ve hiç hesapta olmayan yeni Duygular'a yer açılır! Uzun zamandır işleri başarıyla yürüten Neşe, Üzüntü, Öfke, Korku ve Tiksinti, Kaygı geldiğinde neler hissedeceklerini bilemez. Üstelik Kaygı yalnız değildir, beraberinde Utanç, Gıpta ve Bıkkınlık da gelmiştir."
Culpa Tuya,"Romantik, Dram","Dünya çapında çok izlenen Culpa Mía'nın devam filmi olan bu filmde Noah ile Nick arasındaki aşk, ebeveynlerinin onları ayırmak için gösterdiği tüm çabalara rağmen sarsılmadan devam etmektedir. Ama Nick'in işi ve Noah'nın üniversiteye başlaması, ilişkilerinin ve Leister ailesinin temellerini sarsacak yeni ilişkilere kapı aralar. Bu kadar insanın yıkmaya çalıştığı bir ilişki ayakta kalabilir mi?"
Venom: Son Dans,"Aksiyon, Bilim-Kurgu, Macera","Venom: Son Dans (2024), Eddie Brock ve Venom’un hikâyesinin son bölümünü işleyen bir bilim kurgu, aksiyon ve macera filmidir. Bu filmde, Eddie ve simbiyotu Venom, artık bir arada yaşamaya alışmışlardır. Ancak, kendilerini hem dünyalarından hem de başka düşmanlardan kaçmak zorunda kalan birer kaçak olarak bulurlar. Bu durum, Eddie ve Venom’un hayatta kalmak için güçlü bir ortaklık kurmasını gerektirir."
28 Hafta Sonra,"Korku, Gerilim, Bilim-Kurgu",Rage virüsünün Britanya adalarına yayılmasının yarattığı kaos kontrol altına alınmış ve insanlar yavaş yavaş boşaltmak zorunda kaldıkları evlerine geri dönmeye başlamışlardır. Amerikan ordusu da Londra'nın çeşitli yerlerinde düzenin sağlanması ve insanların güvenle evlerine yeniden yerleşebilmelerini sağlamak için yardım etmektedir.
Deadpool & Wolverine,"Aksiyon, Komedi, Bilim-Kurgu","Wade Wilson’ın bir paralı asker olarak geçirdiği günler ve Deadpool kimliği artık geride kalmıştır. O şimdi sivil hayatta varlık göstermek için çabalar. Wade, yeni hayatına alışmaya çalışırken, büyük bir tehlike ile karşı karşıya kalınca harekete geçmek zorunda kalır. Ancak bu tehlike ile tek başına baş etmesi zordur. Bu yüzden Wade en az kendisi kadar isteksiz olan Wolverine'i yardım etmesi için ikna etmeye çalışır."
Derin Kargaşa,"Aksiyon, Suç, Gerilim","Bezgin bir polis, ölümcül biçimde kontrolden çıkan bir uyuşturucu operasyonundan sonra, yolsuzluğa batmış şehrin yeraltı dünyasında bir siyasetçinin oğlunu kurtarmak için savaşır."
Superman,"Aksiyon, Macera, Bilim-Kurgu","Metropolis'te çaylak bir muhabir olan Superman, Clark Kent olarak büyüdüğü hayatıyla Krypton mirasını bağdaştırmak üzere bir yolculuğa çıkar."
Kung Fu Panda 4,"Animasyon, Aile, Aksiyon, Komedi, Macera, Fantastik","Ejderha Savaşçı Po, eşsiz cesareti ve dövüş sanatlarındaki yetenekleriyle kötü adamları alt ettiği üç maceradan sonra yeniden maceraya atılır; Huzur Vadisi'nin ruhani lideri olması için görevlendirilir. Bu da birkaç sorunu ortaya çıkarır. Birincisi, Po'nun ruhani liderlik hakkında bildikleri taş devri diyeti hakkında bildikleri kadardır ve ikincisi ise bu yeni ulu pozisyonunu üstlenmeden önce hızla yeni bir ejderha savaşçı bulması ve eğitmesi gerekiyordur."
Korku Sokağı: Mezuniyet Balosu,"Korku, Gizem","Shadyside Lisesi'nin 1988'deki mezuniyet balosunda kim kraliçe seçilecek? Bu rekabet, iddiasız Lori için daha adaylar birer birer öldürülmeye başlamadan önce de oldukça acımasızdı."
Titan: OceanGate Denizaltı Faciası,"Belgesel, Dram","OceanGate'in turistik denizaltısı Titan, 2023'te Titanik enkazına yaptığı dalış sırasında patladı. Bu belgesel, cüretkâr bir vizyonun nasıl trajediyle sonuçlandığını anlatıyor."
Cevher,"Dram, Korku, Bilim-Kurgu","Bir aerobik programının yıldızı olan Elisabeth Sparkle, ilerleyen yaşı yüzünden 50. doğum gününde kovulunca yıkılır. Gizemli bir laboratuvar ona, damarlarına zerk edildiğinde ""kendisinin daha iyi bir versiyonunu"" ortaya çıkaracak mucizevi bir maddeyi kullanması önerisiyle yaklaşır."
Yıldızlararası,"Macera, Dram, Bilim-Kurgu","Dünya'nın giderek yaşanmaz hale gelmesiyle başlayan tarım krizi ve doğal felaketler, insanları yok olma tehlikesiyle karşı karşıya bırakmıştır. Teknik bilgisi ve becerisi yüksek olan Cooper, geniş mısır tarlalarında çiftçilik yaparak geçinmektedir; amacı iki çocuğuna güvenli bir hayat sunmaktır. Onlarla yaşayan büyük baba Donald çocuklara göz kulak olurken, henüz 10 yaşındaki kızı Murph şaşırtıcı bir zekaya sahiptir. Geçmişte bıraktığı bilim insanı kariyerini özleyen Cooper'un karşısına bir gün beklenmedik bir teklif çıkar ve ailesinin, dahası insanlığın güvenliği için zorlu bir karar alması gerekir..."
