film_title,category,plot
Rambo: Son Kan,"Aksiyon, Gerilim, Dram","Vietnam Savaşı gazisi John Rambo, Burma'daki olaylardan sonra merhum babasının Arizona'daki at çiftliğinde, eski arkadaşı Maria Beltran ve onun torunu Gabrielle ile birlikte yaşamaktadır. Aradan geçen on bir yılda travma sonrası stres bozukluğu ile baş etmeye çalışan Rambo'nun en büyük yardımcısı genç Gabrielle olmuştur. Lise mezuniyetinden sonra Gabrielle, anneannesinin ve Rambo'nun tüm itirazlarına rağmen biyolojik babasını bulmak için Mekiska'ya gider. Meksika'da kadın ticareti yapan bir kartelin eline düşen Gabrielle'in tek umudu Rambo'dur. Ancak işler, her zaman olduğu gibi Rambo'nun planladığı şekilde gitmeyecek ve bu kez savaş, onun evine gelecektir."
Büyülü Ailem,"Animasyon, Fantastik, Aile, Macera, Komedi","Ebeveynleri güçlü bir büyüyle dev canavarlara dönüşen genç prensesin, çok geç olmadan büyüyü bozmak için hiç bilmediği yerlere doğru bir yolculuk yapması gerekir."
Ölümcül Makineler,"Macera, Bilim-Kurgu",Kıyamet sonrası yeni bir dünyada genç bir kadın ve asi arkadaşları dev bir mobil kent hâline gelen Londra'nın yoluna çıkan her şeyi silip süpürmesini önlemeye çalışır.
Sadakatsiz,"Gerilim, Dram, Romantik","Connie Sumner, kocası ve oğluyla mutlu bir yaşantısı olan bir kadındır. Bir gün iş için New York'ta bulunduğu sırada rüzgar yüzünden dengesini kaybeder ve düşer. O sırada orada bulunan genç kitapçı Paul Martel, kadına yardım eder ve dizindeki yaraya pansuman yapmak için evine davet eder. Connie, genç adamın evinde çok kısa bir süre geçirir ve hemen evine döner. Bu olayın, kocası Edward ile olan ilişkisi için bir test olduğunu düşünmektedir. Ancak bir süre sonra genç adamın dairesine tekrar gider; olaylar artık kontrolden çıkmıştır."
Atlas,"Bilim-Kurgu, Aksiyon",Yapay zekâya hiç güvenmeyen zeki bir terörle mücadele analisti kaçak bir robotu yakalama görevinde iş sarpa sarınca umudunu yapay zekâya bağlamak zorunda kalır.
Taşıyıcı,"Aksiyon, Suç, Gerilim","Frank Martin yaptığı işin en iyisidir. Tehlikeli veya yasadışı maddeleri hiçbir soru sormadan bir noktadan diğerine taşır. Ama en son sevkiyatında, uluslararası esir tüccarlarının kaçırdığı güzel bir kadın, onun taşıma planlarında ölümcül problemler çıkmasına neden olur. Artık Frank değerli kargosunu ve kendi hayatını kurtarmak için durmak bilmeyen, hareket dolu bir savaşa girmelidir."
Hit Man,"Komedi, Romantik, Suç","Şehrin polis teşkilatında ek iş yapan bir üniversite profesörü olan Gary, görev için sahte bir tetikçi kılığına girdiğinde hayatı değişir. ""Kiralık Katil"" hizmetinden yararlanmak isteyen Madison ile tanıştığında aralarındaki çekim ikisini de tehlikeli ve şüpheli durumlara sürükler."
Hit Man,"Komedi, Romantik, Suç","Şehrin polis teşkilatında ek iş yapan bir üniversite profesörü olan Gary, görev için sahte bir tetikçi kılığına girdiğinde hayatı değişir. ""Kiralık Katil"" hizmetinden yararlanmak isteyen Madison ile tanıştığında aralarındaki çekim ikisini de tehlikeli ve şüpheli durumlara sürükler."
Oyunun Sonu,"Gerilim, Dram","Yıllardan 2008. Yer Wall Street. Hisseleri yerle bir olmak üzere olan bir yatırım bankasındayız. Tıpkı Lehmann Brothers gibi.Bankanın üst düzey yöneticileri, çalışanları işten çıkartarak krizi erteleyen geçici çözümlerle günü kurtarırken, düzensizliğin daha fazla yürümeyeceği de gün yüzüne çıkıyor. Üst düzey yönetici kademesi şimdi ahlaki bir çıkmazın eşiğinde, zira kendilerine güvenerek yatırım yapan müşterileri durumdan haberdar etmeleri gerekiyor. Fakat bu durumun büyük oyuncuların hiç hoşuna gitmeyeceği aşikar..."
Rambo: İlk Kan 2,"Aksiyon, Macera, Gerilim, Savaş","İlk filmde yaşanan olayların üzerinden üç yıl geçmiştir. Vietnam savaşından sonra bir grup Amerikan askerinin Vietnam'da esir olarak bırakıldığı haberleri basında yer almaya başlayınca eski ABD Ordusu askeri John Rambo, eski komutanı Albay Sam Trautman tarafından hapishanede ziyaret edilir. Hükümet, bu haberlerin doğrulanması için özgürlüğü karşılığında Rambo'nun yardımını istemektedir. Görevi kabul eden Rambo, yapılan plana göre düşmanla sıcak temasa girmeden sadece bilgiyi doğrulayıp ülkesine geri dönecektir. Ancak işler planlandığı gibi gitmeyip kendi ülkesi tarafından ihanete uğrayınca Rambo, tekrar geldiği bu cehennemden kendi olanakları ile kurtulmaya çalışacaktır."
Ailem Robotlara Karşı,"Animasyon, Macera, Komedi","Katie Mitchell, hayalini kurduğu sinema okulunu kazanınca mutluluktan deliye döner. Evinden kilometrelerce uzaklıktaki okuluna gitmek için hazırlıklara başlayan Katie’ye bu yolculuğunda ailesi de eşlik eder. Keyifli bir şekilde yola koyulan aile, yolculuk sırasında robotların dünyayı istila ettiğini öğrenir. Teknoloji ayaklanıp, robotlar sokaklarda dolaşmaya başlayınca, aile dünyayı kurtarmak için zorlu bir mücadeleye girişir."
Kadınlar Ne İster,"Komedi, Romantik","Chicago'da reklamcılıkla uğraşan Nick Marshall, talihsiz bir kaza sonucunda kadınların aklını okuma yeteneği kazanır. Kaderin garip cilvesinin bu armağanını, kadınları daha yakından tanımak için kullanmaya başlayan Nick, bir süre sonra yeni patronu Darcy McGuire'ı etkilemek amacıyla da, bu yeteneğine başvurmakta sakınca görmez. Ne var ki Nick'in bu çekici ve akıllı kadına aşık olması, bir yandan da kadınların gerçekten ne istediğini keşfetmesi fazla zaman almayacaktır."
Evdeki Düşman,"Korku, Gerilim","Bebekleri ana karnındayken yaşamını yitiren Kate ve John büyük bir travma yaşamışlardır. Hayatları perişan olan çift bir çıkış yolu bulmak zorundadırlar. Bu elim olay hem evliliklerini hem de Kate'in kırılgan ruh halini olumsuz yönde etkilemiştir çünkü Kate, kabusların ve geçmişinden gelen şeytani ruhların pençesindedir. Yaşamlarını olağan hale sokmaya çalışan çift bir çocuk daha evlat edinmeye karar verir. Gerek John gerek Kate yöredeki bir yetimhanede Esther adındaki ""küçük bir kıza"" adeta çekildiklerini hissederler. Ama Esther'in büyük sırları vardır. Ailesinin güvenliğinden endişe eden Kate, John'a ve diğerlerine Esther'ın sevimli maskesinin ardındaki yüzünü göstermeye çalışır. Ama uyarılarına kulak asılmaz ve belki de herkes için çok geç olana dek bu durum devam eder."
Avatar: Ateş ve Kül,"Bilim-Kurgu, Macera, Fantastik","Pandora gezegeninde geçen destansı macera devam ediyor. Jake Sully ve Neytiri'nin ailesi, Pandora'nın ateş kabilesiyle tanışır ve yeni tehditlerle yüzleşirler. İnsanlar, Pandora'nın kaynaklarını sömürmeye devam ederken, Na'vi halkı doğayla uyum içinde yaşamaya çalışır. Jake ve Neytiri, ailelerini korumak ve Pandora'yı savunmak için büyük bir mücadeleye girişirler."
65,"Aksiyon, Macera, Bilim-Kurgu","Korkunç bir kaza sonucu bilinmeyen bir gezegende pilot Mills fark eder ki aslında o Dünya’nın üzerine iniş yapmıştır… 65 milyon önceki dünyaya. Artık Mills ve onun dışında tek hayatta kalan kız Koa için kurtulmanın tek yolu, tarih öncesinde yaşayan tehlikeli yaratıklarla dolu bu araziden kaçmak."
Jüpiter Yükseliyor,"Bilim-Kurgu, Fantastik, Aksiyon","İnsanlığın bu dünyada tek olduğunu düşündüğü bir zamanda, kendi halindeki genç bir kız, Evrenin Kraliçesi tarafından suikaste gitmek üzeredir. Ancak dünya dışından başka birisi onu kurtarır. Ve Evrenin Kraliçesi'nin hükümdarlığını sona erdirmesi için o kıza ihtiyacı vardır."
Yarından Sonra,"Aksiyon, Macera, Bilim-Kurgu, Gerilim","Dünya, doğanın gazabına uğramaktadır. Şiddetli kasırgalar Los Angeles'ı haritadan silmiş, Yeni Delhi karlar altına gömülmüş, Tokyo devasa dolu yağışıyla yıkılırken New York ani iklim değişikliği ile dev dalgaların tehditi altında kalmıştır. Bir iklim bilim uzmanı olan Jack Hall, dünyayı, küresel ısınmanın tetiklediği bu felaketten kurtarmak için çözüm arayışındadır.  Kurtuluş Günü'nün yaratıcısı Roland Emmerich, dünyayı bu kez uzaylılar tarafından değil, bizzat doğanın kendisi tarafından yok ediyor. Devasa doğal felaketler, büyük paralar harcanarak ve bilgisayar teknolojisinin de katkısıyla nefes kesen gerçekçilikte sahnelere dönüştürülmüş. Denis Quaid, Jake Gyllenhaal ve Ian Holm'un da katılımıyla filmin kadrosu da en az efektleri kadar dikkat çekiyor."
Uçuk Bir İş,"Aksiyon, Komedi, Suç","Gözünü yükseklere diken profesyonel bir hırsız ve uzman ekibi, 12.000 metre yükseklikte seyreden bir uçaktaki kasadan 500 milyon dolar değerindeki altını çalmaya kalkışır."
Shazam! 6 Güç,"Aksiyon, Komedi, Fantastik","Herkesin içinde bir süper kahraman yatar, kimileri için bu birkaç sihirli sözcük ile ortaya çıkabilir! 1939 yılında yaratılan süper kahraman Shazam, genç Billy Batson'ın ihtiyaç anlarında sihirli sözcükleri söyleyerek dönüşebildiği bir süper kahraman. Sihirli sözcükleri söylediği an dünyanın en güçlü ölümlüsüne dönüşen karakter, gündelik hayatında okul ödevleri gibi meselelerle boğuşurken, süper kahraman olduğunda da dünyanın güvenliği için mücadele veriyor. Süleyman'ın bilgeliği, Herkül'ün gücü, Atlas'ın dayanıklığı, Zeus'un kudreti, Aşil'in cesareti ve Merkür'ün hızına sahip olan karakter, edindiği güçlerin sahiplerinin baş harfleri ile S.H.A.Z.A.M. adını alıyor."
Öldüren Sis,"Korku, Bilim-Kurgu, Gerilim","Kasabaya sanki başka bir dünyadan gelmiş izlenimi veren tuhaf bir sis tabakasının çökmesi üzerine korku ve panik içinde süpermarkete sığınan kasaba halkı arasında David Drayton ve küçük oğlu Billy de vardır.Koyu ve kalın sis tabakasının içinde esrarengiz bazı yaratıkların pusuya yatmışçasına gizlendiğini ilk fark eden David olmuştur. Bu dünyaya ait olmayan öldürücü, korkutucu yaratıklardır bunlar… Kurtuluş ise marketteki herkesin hep birlikte hareket etmesine bağlıdır. Ancak insan doğası hesaba katılınca hep birlikte hareket edebilmeleri mümkün müdür?Markete sığınan kasaba halkının korkuya kapılarak paniklemesi üzerine mantık devre dışı kalırken David kendisini en çok neyin korkuttuğunu merak etmeye başlamıştır: Sisin içinde pusuya yatmış canavarlar mı, yoksa marketin içindeki, daha düne kadar arkadaşı, komşusu bildiği insanların sergilediği tutarsız davranışlar mı?"
Han Solo: Bir Star Wars Hikayesi,"Bilim-Kurgu, Macera, Aksiyon","Çok çok uzak bir galakside, sevilen kötü karakterlerin çok olduğu filmde macera dolu bir yolculuğa çıkıyoruz. Karanlık ve tehlikeli yeraltı dünyasında cesaret gerektiren maceralara atılırken Han Solo gelecekteki muhtemel yardımcı pilotu Chewbacca ile arkadaş olur. Ve Star Wars efsanesindeki beklenmedik kahramanların rotasını belirleyen bu yolculukta, kötü nam salmış kumarbaz Lando Calrissian ile tanışır."
The Greatest Beer Run Ever,"Dram, Komedi, Savaş","The Greatest Beer Run Ever, 1967 yılında Vietnam’daki Amerikan askerlerine destek mesajları ve bira götürmek üzere New York’tan yola çıkan John “Chick” Donohue’nün öyküsünü anlatıyor. Amerika’da 60’ların savaş karşıtı protestoları arasında Vietnam’daki Amerikan askerlerine destek vermek isteyen Chick, Amerikan birası ile doldurduğu sırt çantası ile birlikte bir yük gemisine atlar ve Vietnam’a doğru yola çıkar. Tet Saldırısı’nda Kuzey Vietnam güçleri tarafından yakalanan Chick aylarca Saigon’da mahsur kalır."
Çılgın Maks,"Macera, Aksiyon, Gerilim, Bilim-Kurgu","Mel Gibson’un Max Rockatansky adında bıkkın bir polisi canlandırdığı film, peşine düştüğü çetenin yardımcısını öldürmesinden sonra kendisini ve ailesini hayatta tutmak için harekete geçen bir polisin hikayesini anlatıyor."
Greyhound,"Savaş, Aksiyon, Dram","Kaptan Ernest Krause, 37 gemilik uluslararası bir konvoya liderlik ederek, Atlantik’in tehlikeli sularını aşıp binlerce askeri ve acilen ihtiyaç duyulan malzemeleri Müttefik kuvvetlerine ulaştırıyor."
Gunner,"Aksiyon, Gerilim, Suç","Savaş gazisi Albay Lee Gunner, uzun süre cephede kaldıktan sonra çocuklarıyla yeniden bağlantı kurmak için iki oğlunu amcaları Jon'la birlikte kamp gezisine çıkarır. Jon bir tuzak teline takılıp bir patlama başlattığında yolculuk ters gider ve büyük bir uyuşturucu operasyonunun ortasında şiddet yanlısı bisikletçilerden oluşan bir çeteyi alarma geçirir. Gunner'ın seçkin dövüş becerilerini öngöremeyen çete üyeleri birer birer ortadan kaldırılır. Bu sırada çocuklar yardım istemeye çalışsalar da sonunda kendilerini çetenin elebaşı Kendric Ryker'ın oğlu ve tüm örgütü hapishaneden yöneten Dobbs'un kollarına bırakırlar. Kendinden başka sığınacak kimsesi olmayan öfkeli Gunner, iki oğlunu kurtarmak için ortalığı kasıp kavurur, ta ki zirveye çıkıp Ryker'la yüzleşene kadar."
Tinker Bell: Gizemli Kanatlar,"Animasyon, Aile, Fantastik, Macera","Disney'in Faries bünyesinde 3D olarak tasarlanan ilk film olma özelliğini taşıyan Tinkerbell: Gizemli Kanatlar, Tinker Bell ve peri arkadaşlarıyla birlikte izleyicisini Kış Ormanı'nın büyülü dünyasında bir yolculuğa çıkartıyor. Burada merak ve macera duygusuyla Tinker Bell, inanılmaz bir keşifte bulunuyor ve dünyasını önlenemez bir şekilde değiştirecek bir sırrı gün yüzüne çıkartıyor."
Kaos: Manson Vakası,"Belgesel, Suç","1969'un Ağustos ayında, Charles Manson'ın müritleri onun emriyle yedi kişiyi neden öldürdü? Zihin kontrolü, CIA deneyleri ve cinayet temalı bu komployu keşfedin."
The Lobster,"Komedi, Dram, Romantik","Çok da uzak olmayan bir gelecekten ilginç bir distopya öyküsü anlatıyor bize Istakoz. Yalnız kalmış, ilişkisi olmaya insanların tutuklandığı, alternatif bir gelecekte geçen öyküde, bekar insanlar korkunç bir otele yerleştirildikten 45 gün sonra, kendileriyle eşleşen kişiyle ilişkiye başlamak zorunda kalıyorlar. Eğer ki ilişkilerinde başarıyı yakalayamazlarsa, kendilerinin seçtikleri bir hayvana dönüştürülüyorlar!"
Peter Pan,"Animasyon, Aile, Macera, Fantastik","Kalbinizde Sonsuza Kadar Yaşayacak  İnanırsak her şeyi başarabileceğimizi öğreten Disney'in Muhteşem Klasiği Peter Pan ile rüyalarınızın sizi uçurmasına izin verin! Büyülü bir dünya, inanılmaz bir macera, unutulmaz karakterler, peri tozu ve muhteşem müzikler Peter Pan ile evlerinize geliyor.  En sevdikleri masal kahramanı Peter Pan'in evlerine gelmesi ve onları Varolmayan Ülke'nin büyülü topraklarına uçurmasıyla, Wendy ve erkek kardeşleri için macera başlar.Peter Pan ve en yakın arkadaşı Tinker Bell'in eşliğinde, adayı, Peter'in gizli saklanma yerini ve kayıp çocukları keşfeden Wendy ve kardeşleri için asıl sürpriz ise şöhretsiz Kaptan Hook ve onun korsanlarıyla tanışmalarıdır."
Need For Speed: Hız Tutkusu,"Aksiyon, Suç, Dram, Gerilim","Tobey Marshall, babasının ölümünün ardından kendilerine kalan borçları temizleyebilmek için var gücüyle çalışmaktadır. Mesai saatlerini otomobil tamiratıyla geçiren Tobey, hafta sonlarını yer altı otomobil yarışlarında yarışarak geçirmektedir. Yarışlarla birlikte arabalara ve adrenaline duyduğu tutku katbekat artarken, Dino Brewster isimli düşmanından büyük bir teklif alır. Son derece zengin bir adam olan Dino, Tobey'den dünyanın en hızlı ve donanımlı Mustang'ini yapmasını ister. Tobey de gerekli olan parayı böylece tamamlayabileceğini düşünürek bu teklifi kabul eder."
İlk Kan,"Aksiyon, Macera, Gerilim, Savaş","Eski bir Vietnam gazisi olan John Rambo, terhis olduktan 7 yıl sonra yürüyerek geldiği bir kasabada biraz dinlenip karnını doyurmak ister. Ancak kasabanın şerifi, Rambo'yu hoş karşılamaz ve kasabadan ayrılmak istemeyen Rambo'yu tutuklayıp karakola götürür. Karakolda gördüğü işkenceler sırasında aklına savaşta yaşadıkları gelen Rambo kendini kaybeder ve kasabanın yakınındaki ormanlık alana kaçar. Peşindeki güvenlik güçlerinden kurtulmak için gördüğü eğitimi uygulamaktan başka şansı olmayan Rambo'nun eski Yeşil Bereli olduğunu öğrenen polis kuvvetleri ise eski komutanı Albay Samuel Trautman'dan yardım isteyecektir."
Gün Batımından Şafağa,"Korku, Aksiyon, Gerilim, Suç","Gecko biraderler, rüzgarı arkalarına alıp Meksika’nın özgür ortamına doğru bir yolculuğa çıkarlar. Texas’ta sıkı bir soygun yaptıklarından dolayı, ne olur ne olmaz diye bir rahip ve ailesini de yanlarında rehin olarak bulundururlar. Buluşma için bir Meksika barının kapısını aşındırdıklarında başlarına geleceklerden habersizdirler. Mekan kesinlikle vampirlerin içeri alınmadığı barlardan değildir!Quentin Tarantino’nun senaryosunu yazıp başrollerinden birine geçtiği film, Robert Rodriguez'in, El Mariachi ve Desperado filmleriyle başladığı sinema kariyerinin şimdilik en parlak filmlerinden birisi."
Yerçekimi,"Bilim-Kurgu, Gerilim, Dram","Dr. Ryan Stone zeki bir tıp mühendisidir ve emekliliğinden önce son görevine çıkan yetenekli ve deneyimli astronot Matt Kowalsky'nin yönetimindeki mekikte ilk uzay yolculuğuna çıkar. Herşey yolunda gibi görünürken rutin bir keşif yürüyüşü sırasında bir felaket yaşanır. Mekik çarpan bir cisim sonucu paramparça olur. İki bilim insanı uzay boşluğunda yapayalnız kalırlar. Yeryüzü ile iletişimleri tamamen kopmuştur ve sonsuz karanlıkla başbaşadırlar. Şimdi korkunun yerini panik alır, üstelik var olan sınırlı oksijenleri de gitgide tükenmektedir. İkili eve, dünyaya dönüş yolunu bulabilecek midir?"
Canavar Ev,"Animasyon, Komedi, Aile, Fantastik","Ergenliğe girmeden önceki sıkıntılı dönemin sancılarını çeken DJ Walters’ın kafası, uzun süredir karşı caddedeki ihtiyar Nebbercracker’ın evine takılmıştır. Evin bahçesine atılan herşey garip bir şekilde kaybolmaktadır. DJ Walters ve arkadaşı Chowder, bir gün bizzat, evin bahçeye düşen basket topunu içine çektiğine şahit olurlar. Buna ek olarak bir de ev, arkadaşları Jenny’ yi yutmak isteyince üç çocuk büyük bir korkuya kapılırlar.Mahalleliyi evde olup biten garip şeyler konusunda inandıramayınca DJ, Chowder ve Jenny bu gizemi çözmeyi üzerlerine alırlar. Mahallelerini Cadılar Bayramı öncesi güvenli bir yer haline getirmek, artık bu üç çocuğun görevidir."
Servet Operasyonu,"Aksiyon, Komedi, Gerilim","Servet Operasyonu, dünya için büyük tehdit oluşturan yeni bir ölümcül silah teknolojisinin ticarileştirilmesini önlemek için zorlu bir maceraya atılan bir ajanın hikayesini konu ediyor. M16 ajanı Orson Fortune, dünya için büyük tehdit oluşturan yeni bir ölümcül silah teknolojisinin ticarileştirilmesini önlemek için uluslararası bir istihbarat ittifakı olan ""Five Eyes"" tarafından işe alınır. Bu süreçte CIA teknoloji uzmanı Sarah Fidel ile birlikte çalışmak zorunda bırakılan Fortune, zengin bir silah tüccarının izini sürmeye çalışırken dünyayı dolaşmak zorunda kalır."
Zombilerin Şafağı,"Korku, Komedi","Shaun, hayatında ciddi olarak daha hiçbir şeyi başaramamıştır. Tüm hayatı, ne için yaptığını hala bilmediği işi, iki deli ev arkadaşı Ed ve Pete, kız arkadaşı Liz ve annesi arasında gidip gelmektedir. Hayatındaki en önemli şeyse, kendini bulduğu tek yer olan Winchester adlı bardır.Liz tarafından ilgisiz olmakla, annesi tarafından yeteneksiz olmakla suçlanır, arkadaşları ise O’nun hakkında yorum yapacak kadar bile akıllı değildir. Shaun bir gün hayatının fırsatını yakalayacağını düşünmekle zamanını harcarken bütün Kuzey Londra’yı zombiler basar. Sokaklar ölülerin işgali altında kalınca ve ölüm hemen yanı başınızda olunca ne hissedersiniz? Tabi ki Shaun gibi sevdiğiniz herkesi kurtarmayı. Zaten kurtarılacaklar listesinde sadece dört isim vardır; Liz, Ed, Pete ve anne."
Lego Batman Filmi,"Animasyon, Aksiyon, Komedi, Aile","Sakin ve durağan bir hayat süren Batman kocaman evinde tembellik ederken, yeni yardımcıları Robin ve Batgirl'ün ortaya çıkmasıyla işler değişir. Ekip henüz birbirine alışamadan Joker'in hain bir planla Gotham'ı tehdit ettiği haberi duyulunca, taze ekip birleşmek zorunda kalacaktır."
Canavar Ev,"Animasyon, Komedi, Aile, Fantastik","Ergenliğe girmeden önceki sıkıntılı dönemin sancılarını çeken DJ Walters’ın kafası, uzun süredir karşı caddedeki ihtiyar Nebbercracker’ın evine takılmıştır. Evin bahçesine atılan herşey garip bir şekilde kaybolmaktadır. DJ Walters ve arkadaşı Chowder, bir gün bizzat, evin bahçeye düşen basket topunu içine çektiğine şahit olurlar. Buna ek olarak bir de ev, arkadaşları Jenny’ yi yutmak isteyince üç çocuk büyük bir korkuya kapılırlar.Mahalleliyi evde olup biten garip şeyler konusunda inandıramayınca DJ, Chowder ve Jenny bu gizemi çözmeyi üzerlerine alırlar. Mahallelerini Cadılar Bayramı öncesi güvenli bir yer haline getirmek, artık bu üç çocuğun görevidir."
Servet Operasyonu,"Aksiyon, Komedi, Gerilim","Servet Operasyonu, dünya için büyük tehdit oluşturan yeni bir ölümcül silah teknolojisinin ticarileştirilmesini önlemek için zorlu bir maceraya atılan bir ajanın hikayesini konu ediyor. M16 ajanı Orson Fortune, dünya için büyük tehdit oluşturan yeni bir ölümcül silah teknolojisinin ticarileştirilmesini önlemek için uluslararası bir istihbarat ittifakı olan ""Five Eyes"" tarafından işe alınır. Bu süreçte CIA teknoloji uzmanı Sarah Fidel ile birlikte çalışmak zorunda bırakılan Fortune, zengin bir silah tüccarının izini sürmeye çalışırken dünyayı dolaşmak zorunda kalır."
Zombilerin Şafağı,"Korku, Komedi","Shaun, hayatında ciddi olarak daha hiçbir şeyi başaramamıştır. Tüm hayatı, ne için yaptığını hala bilmediği işi, iki deli ev arkadaşı Ed ve Pete, kız arkadaşı Liz ve annesi arasında gidip gelmektedir. Hayatındaki en önemli şeyse, kendini bulduğu tek yer olan Winchester adlı bardır.Liz tarafından ilgisiz olmakla, annesi tarafından yeteneksiz olmakla suçlanır, arkadaşları ise O’nun hakkında yorum yapacak kadar bile akıllı değildir. Shaun bir gün hayatının fırsatını yakalayacağını düşünmekle zamanını harcarken bütün Kuzey Londra’yı zombiler basar. Sokaklar ölülerin işgali altında kalınca ve ölüm hemen yanı başınızda olunca ne hissedersiniz? Tabi ki Shaun gibi sevdiğiniz herkesi kurtarmayı. Zaten kurtarılacaklar listesinde sadece dört isim vardır; Liz, Ed, Pete ve anne."
Lego Batman Filmi,"Animasyon, Aksiyon, Komedi, Aile","Sakin ve durağan bir hayat süren Batman kocaman evinde tembellik ederken, yeni yardımcıları Robin ve Batgirl'ün ortaya çıkmasıyla işler değişir. Ekip henüz birbirine alışamadan Joker'in hain bir planla Gotham'ı tehdit ettiği haberi duyulunca, taze ekip birleşmek zorunda kalacaktır."
Terminatör: Kurtuluş,"Aksiyon, Bilim-Kurgu, Gerilim","Yıl 2018. Geçte olsa Mahşer Günü gelip, modern uygarlığı yıkarak geçmiştir. Beklenildiği gibi makineler kontrolü ele geçirmiştir. Hayatı boyunca uyarıldığı geleceği durdurmak için elinden geleni yapan ama başarısız olan John Connor geriye kalan bir grup insanı Skynet'e ve ordularına karşı direnmek için örgütlemiştir. Ancak John Connor'ın bu savaşı kazanabileceğine olan inancı Marcus Wright isminde bir yabancının ortaya çıkmasıyla sarsılır. Bu garip, yeni dünyada uyanan Marcus en son bir hapishane hücresinde olduğunu hatırlamaktadır. Connor, Marcus'un gelecekten mi yoksa geçmişten mi geldiğini anlamaya çalışırken Marcus’un güvenilir biri olup olmadığına karar vermek zorundadır. Bu sorulara cevap bulmak için yeterli zamanı olmayan Conor, Marcus’u da yanlarına alarak, küçük bir saldırı timi ile birlikte Skynet'in insanoğlunu tamamen ortadan kaldırabilecek son saldırısını engellemek için Skynet'in ana üssüne doğru yola çıkar."
Kapıdaki Düşman,"Dram, Savaş, Tarih, Romantik","Yıl 1942. Naziler Rusya'da ölümcül bir harekata girişmiştir. Kruschev'in liderliğindeki Stalingrad vatandaşlarıysa cesur bir direnişe geçmiş, yerel halk kahramanı Vassili Zaitsev'in ışığıyla tek yumruk haline gelmiştir. Uzman bir keskin nişancı olan Vassili'nin gösterdiği kahramanlıklar en yakın arkadaşı politik subay Danilov tarafından yürütülen bir propaganda sayesinde efsaneleşmiştir. Vassili'yi durdurmak için Almanlar en iyi keskin nişancıları olan Albay Konig'i Stalingrad'a gönderirir..."
Aşktan da Üstün,"Gerilim, Romantik, Gizem","Dünya Savaşı sırasında hüküm giymiş bir Nazi savaş suçlusunun kızı olan Alicia'yla Amerikan Hükümeti adına casusluk yapması için temasa geçilir. Aşk, gerilim ve tutku gibi Hitchcock temaları etrafında dönen film, ustanın en iyi filmlerinden birisi olarak kabul ediliyor. Film diğer Hitchcock filmleri gibi gerilim türünde olsa da; alt metin olarak asıl aşkı ele alıyor. Filmde Grant, ajan rolünde; Bergman da Almanya vatandaşı olan, babası kirli işlere karışmış, babasının yaptığı pis işleri öğrendiğinde Amerika hükümetine çeteye sızan birini canlandırıyor."
