film_title,category,plot
Bay ve Bayan Smith,"Aksiyon, Komedi, Dram, Gerilim","John ve Jane Smith, renksiz bir evlilik süren sıradan bir şehirli çifttir. Ancak her ikisi de diğerinin öğrenmek için cinayet işleyebileceği bir sır gizlemektedir: Bay ve Bayan Smith, yüksek ücretli, olağanüstü kiralık katildirler ve rakip kurumlar için çalışmaktadırlar. Bay ve Bayan Smith, birbirlerini öldürmek için kiralandıklarında evliliklerinde yeni bir heyecan kaynağı bulurlar ve eğlence başlar. Bay ve Bayan Smith, ölümcül yeteneklerini ortaya koyup evliliklerini müthiş bir sınava soktuklarında sonuç muhteşem bir macera yapıtına dönüşür."
Balerin,"Aksiyon, Gerilim","Korumakta başarısız olduğu en yakın arkadaşının yasını tutan eski koruma Ok-ju, onun son dileğini gerçekleştirmek, yani intikamını almak için harekete geçer."
Senden Başka,"Romantik, Komedi",Harika bir ilk randevunun ardından Bea ve Ben'in ateşli çekiciliği buz gibi bir hal alır; ta ki kendilerini Avustralya'daki bir düğünde beklenmedik bir şekilde yeniden bir araya gelene kadar. Böylece her iki olgun yetişkinin yapacağı şeyi yaparlar: bir çiftmiş gibi davranmak.  Peki birbirlerinden nefret etmelerine rağmen bu oyunu sürdürebilecekler midir?
Gizli Sayılar,"Dram, Tarih","Gizli Sayılar, yıldızları hedefleyerek ülkenin temellerini değiştiren parlak bir kadın grubunun inanılmaz, anlatılmamış, ancak gerçek hikayesini ortaya çıkarıyor. Film, NASA'daki siyah kadın matematikçilerden oluşan seçkin bir takımın, Sovyetler Birliği'ndeki Amerikalı rakiplerine karşı uzay yarışını kazanmasına yardımcı oldukları ve aynı zamanda, eşit haklara ve fırsatlara ilerlemeye yönelik arayışların hayati tarihini anlatıyor."
Borderlands,"Aksiyon, Bilim-Kurgu, Komedi","Borderlands, 2009'da Gearbox stüdyosu tarafından piyasaya sürülen video oyununun uyarlamasından bir filmdir.  Kötü şöhretli kaçak lilith, Pandora adlı gezegenine döndükten sonra, ona tehlikeli bir görev verilir. Diğer suçlularla (eski paralı asker Roland, patlayıcı uzmanı Tiny Tina ve koruyucusu Krieg, çılgın bilim insanı Tannis ve esprili robot Claptrap olmak üzere) bir ittifak ve aynı zamanda ciddi bir arkadaşlık kurar. Görev: Güçlü bir adam olan Atlas'ın kayıp kızını bulmak ve korumaktır. Ancak her şey göründüğü gibi olmayabilir. Çünkü kız, evrenin kaderini değiştirebilecek büyük bir güce sahiptir."
Thor: Aşk ve Gök Gürültüsü,"Fantastik, Aksiyon, Komedi","Marvel Studios'un ""Thor: Aşk ve Gök Gürültüsü"" filminde Gök Gürültüsü Tanrısı, kendini bulacağı benzersiz bir yolculuğa çıkıyor. Ne var ki çabaları, Tanrı Kasabi Gorr olarak bilinen ve tüm tanrıları yok etmeyi amaçlayan bir katil tarafından sekteye uğratılıyor. Thor da onunla şavaşmak için Kral Valkyrie'nin, Korg'un ve Yüce Thor olarak büyülü çekiç Mjolnir'i açıklanamayan bir biçimde kullanmayı başaran eski kız arkadaşı Jane Foster'in yardımına başvurur. Hep birlikte, Tanrı Kasabı'nın kininin ardında yatan gizemi açığa çıkarmak ve iş işten geçmeden önce onu durdurmak üzere kozmik bir maceraya atılırlar."
Büyük Hesaplaşma,"Suç, Dram, Aksiyon",İnatçı bir Los Angeles emniyet müdürlüğü komiseri acımasız ve ölümcül bir profesyonel hırsızın ve onun suç ortaklarının peşine amansız bir şekilde düşer.
Demon Slayer: Mugen Treni,"Animasyon, Aksiyon, Fantastik, Gerilim","Film ailesi acımasızca öldürülen Tanjiro Kamado'nun hikayesini anlatıyor.Tanjiro Kamado, ailesi acımasızca öldürüp, kız kardeşinin bir çeşit iblise dönüştürülmesinden sonra, iblis avcılığına başlar. Tanjiro ve arkadaşları, umutsuzluğa çıkan yolda Mugen Treni'nin peşine düşer."
İtaat,"Korku, Bilim-Kurgu, Gerilim","Gelişmiş bir yapay zeka sistemi tarafından yönetilen bir toplumu konu alıyor. Bu toplumda insanlar, yapay zekanın belirlediği kurallara uymak zorundadır ve bu durum, insanların yaşamlarını büyük ölçüde kontrol altına alır. Baş karakter olan genç bir kadının, yapay zekanın kendisine ve çevresindekilere uyguladığı baskıya karşı çıkma mücadelesini anlatıyor. Ana karakter, başlangıçta sistemin bir parçası olarak yaşarken zamanla yapay zekanın kararlarının ve etkisinin ne kadar tehlikeli olabileceğini fark eder. Kendisi ve sevdikleri için daha iyi bir gelecek arayışına girer ve bu süreçte, diğer insanları da harekete geçirmeye çalışır."
Aşk Peşinde Bir Yıl,"Romantik, Komedi, Dram","Annesi tarafından ergenliğindeki yapılacaklar listesini tamamlamakla görevlendirilen genç bir kadın; aile sırlarını açığa çıkarır, aşkı bulur ve kendini yeniden keşfeder."
Şaşkın İmparator,"Macera, Animasyon, Komedi, Aile, Fantastik",Uzun zaman önce uzak bir diyarda aklı bir karış havada olan genç İmparator Kuzco iktidar ihtirası ile yanıp tutuşan danışmanı Yzma tarafından lamaya dönüştürülür. Vahşi bir ormanın ortasında tek başına kalan Kuzco'nun geri dönüşünde ona yardımcı olacak tek kişi iyi kalpli bir köylü olan Pacha'dır. Kuzco'nun Yzma varmadan önce krallığa geri dönmesi gerekmektedir. Kuzco ve Pacha'yı binbir tehlike ve macerayla dolu bir yolculuk beklemektedir.
Kırmızı,"Animasyon, Aile, Komedi, Fantastik","Kırmızı filmi, annesinin sorumluluk sahibi minik kızı olmak ile ergenliğin karmaşası arasına kalan, kendine güvenen, 13 yaşındaki Mei Lee'yi bizlere tanıtıyor. Mei'nin baskıcı sayılabilecek kadar koruyucu annesi Ming, kızından asla uzaklaşmak istemez ki bu durum bir ergen için çok talihsizdir. İlgi alanlarındaki, ilişkilerindeki ve vücudundaki değişiklikler yetmezmiş gibi bir de ne zaman heyecanlansa (ki bu neredeyse her zaman olur) ""puf"" diye dev bir kırmızı pandaya dönüşür."
Aşk,"Romantik, Bilim-Kurgu, Dram","Theodore Twombly hayatını, yakın gelecekte nadir bulunan bir şeye dönüşmüş olan el yazımı mektuplar yazarak kazanmaktadır. Ve bu yıllarda insanların işlerini artık bilgisayar programları yerine getirmektedir. Theodore, karısından boşandıktan sonra bir apartman dairesinde tek başına yaşamaya başlar ve bir gün karşılaştığı bir teknoloji reklamıyla birlikte hayatı değişir. Kusursuz bir yapay zeka programı sunan yeni bir işletim sistemi, onu son derece çekici bir kadın olan Samantha ile tanıştırır. Sanal bir varlık olan ve sadece bir sesten ibaret olan Samantha, Theodore'u dünya ve hayat üzerine sorduğu sorularla birlikte bambaşka bir gerçeklikle tanıştırır. Ağır bir depresyonun içerisinde olan Theodore, yavaş yavaş hayatın keyifli yanlarını fark etmeye başlarken yapay zeka programıyla arasındaki ilişki de gitgide tuhaflaşır."
Şeytan Marka Giyer,"Dram, Komedi","New York moda dünyasının göz alıcı karmaşasında, sıfır bedenli muhteşem kadınlar içindeyken saçınızın kötü olduğu bir gün iş hayatınızın sonu olabilir. İşte Runway Dergisi bu inanılmaz cehennemin tam ortasıdır. Miranda Priestly ise moda dünyasının en güçlü kadını Runway'in korku salan kraliçesi kendisine bir asistan alacaktır. Milyonlarca kızın hayatını verebileceği bir iş ise sıradan bir New York'ta yaşayan Andy Sachs için göz kırpmaktadır. Yapacağı iş kesinlikle kendisine saygısı olmayan insanların yapabileceği türden, yaşamı bırakıp çalışmaya dayalı bir tür Miranda köleliğidir."
Luck,"Animasyon, Macera, Komedi, Fantastik",Sam Greenfield dünyanın en şanssız insanıdır! Bir anda kendini Şans Diyarı'nda bulunca şansını döndürmek için sihirli yaratıklarla bir araya gelmesi gerekir.
Can Dostum,"Dram, Komedi","Zengin bir iş adamı ve aristokrat olan Philippe, yamaç paraşütü yaparken geçirdiği kaza sonrası felç olur ve boynundan aşağısını kullanamaz hale gelir. Driss ise hapishaneden henüz yeni çıkmış bir işsizdir. Philippe 7 gün 24 saat boyunca bakımını üstlenmesi için Driss'i evine yatılı yardımcı olarak alınca ikisinin de dünyası değişecektir. Normal şartlar altında hiçbir zaman yan yana gelmeyecek bu ikili iyisiyle kötüsüyle hayatın tadını beraber çıkarmaya başlarlar."
Günaha Davet,"Dram, Suç","Küçük oğlu ve karısı ile birlikte Bronx'da son derece ırkçı bir mahallede yaşayan Lorenzo Anello, maddi durumu iyi olmasa da pis işlere bulaşmadan dürüst bir hayat sürdürmektedir. Bir gün Lorenzo'nun oğlu Calogero, Sonny isimli bir gangsterin, bir adamı sırf park yeri yüzünden öldürdüğünü görür fakat onu polise ihbar etmeyince Sonny ile Calogero arkadaş olurlar. Lorenzo, oğlunun bir gansterle görüşmesine karşı çıkmasına rağmen Calogero git gide Sonny ile daha da yakınlaşacak ve babasının onu yetiştirmeye çalıştığı değerlerden uzaklaşıp kendisini suç dünyasının ortasında bulacaktır. 60?larda geçen bir gangster hikayesi anlatan Günaha Davet, Robert de Niro'nun ilk yönetmenlik denemesi. Sonny rolünde ise filmin uyarlandığı aynı isimli oyunu da yazan Chazz Palminteri'yi görüyoruz."
Beterböcek Beterböcek,"Korku, Komedi, Fantastik","Beklenmedik bir aile trajedisinin ardından, Deetz ailesinin üç nesli Winter River'daki evlerine geri döner. Beterböcek'in hâlâ peşini bırakmadığı Lydia'nın hayatı, asi genç kızı Astrid'in tavan arasındaki gizemli kasaba maketini keşfetmesi ve Öbür Dünya'ya açılan kapının kazara açılmasıyla altüst olur. Her iki âlemde de sorunlar baş gösterirken birinin Beterböcek'in adını üç kez söylemesi ve yaramaz iblisin kendi tarzı karmaşayı ortaya çıkarmak için geri dönmesi artık an meselesidir."
Her Şey Her Yerde Aynı Anda,"Aksiyon, Macera, Bilim-Kurgu","Kocasıyla yıllar önde  Çin’den Amerika’ya göçüp yeni bir hayata başlayan Evelyn, yaşayabileceği alternatif hayatlarla bağlantılı diğer evrenleri keşfederek, tek başına tüm evrenleri kurtarması gereken çılgın bir maceraya sürüklenir."
Alacakaranlık Efsanesi: Tutulma,"Macera, Fantastik, Dram, Romantik","Bella Swan, kendisini yine tehlikenin tam ortasında bulur. Edward Cullen’a olan aşkıyla arkadaşı Jacob Black arasında bir seçim yapmak durumundadır ve vereceği kararın vampirlerle kurt adamlar arasında asırlardır varolan kavgayı ateşleyebileceğinin farkındadır. Bella hayatının en zor kararını vermeyede yaklaşmaktadır."
Arabalar,"Animasyon, Macera, Komedi, Aile","Piston Kupası için The King ve Chick Hicks’e karşı yarışmak üzere Kaliforniya’ya gitmekte olan meşhur yarış arabası Lightning McQueen, kaza ile Radiator Springs adındaki küçük bir kasabanın yollarına zarar verir. Üstelik kendisinin de tamir olması için çok çalışması gerekmektedir. Bu sırada bu olayla beraber o kasabada geçirdiği zamanlarda dostluklar edinir ve gerçek sevgiyi yaşar. Hatta aşkı bile katar yaşamına. Bu küçük kasabada kaldığı sürece değerleri değişmeye başlar. İşte ancak ondan sonra gerçek bir kazanan olmaya hazır hale gelecektir."
Kışkırtma,"Komedi, Dram, Romantik","20 yaşındaki Venedikli güzel Carla, erkek arkadaşı Matteo'nun gelip kendisini ziyaret etmesini beklemektedir. Carla, Matteo için bir apartman dairesi aramaktadır. Emlakçı Maria, Carla'nın karşı koyamayacağı bir şekilde ona olan cinsel ilgisini belli eder. Matteo, içinden gelen bir sesle olanları tahmin eder ve Londra gezisini iptal eder. Carla, Matteo'nun kendisinden ayrılmasına, Maria'nın eski kocası Mario ile yakınlaşarak tepki verir. Mario, Carla'yı Londra'daki çılgın bir partide değişik erotik oyunlara dahil eder. Matteo, şüphelerine rağmen Carla ile Londra'da buluşmaya karar verir. Oldukça dramatik bir şekilde yaptıklarını itiraf ederler ve Matteo, kıskançlığının etkisiyle Carla'yı daha tutkuyla istediğini anlar."
Şrek: Sonsuza Dek Mutlu,"Komedi, Macera, Fantastik, Animasyon, Aile","Serinin bu dördüncü filminde, Şrek ve Fiona'nın yaşamlarının nasıl değiştiğini ve gerçek mutluluğun ne anlama geldiğini keşfetmelerini konu alıyor. Şrek ve Fiona, bataklıklarında huzurlu bir hayat sürmekteler. Ancak, bir gün Şrek, her zaman hayalini kurduğu ""sonsuz mutluk"" gibi bir yaşam için bir dilek tutar. Dileği gerçekleşir, fakat bu durum her şeyin göründüğü kadar mükemmel olmadığını ortaya çıkarır. Şrek, dileği sonucunda kendini tamamen farklı bir dünyada bulur; burada her şey daha parlak ve pırıl pırıl görünmektedir, ama aynı zamanda da oldukça yanıltıcıdır. Bu yeni dünyada, Şrek ve Fiona, gerçek aşkın ve dostluğun değerini sorgulamak zorunda kalırlar."
Sihirbazlar Çetesi,"Gerilim, Suç","Film, J. Daniel Atlas isimli son derece karizmatik ve etkileyici bir illüzyonistin liderliğini yaptığı, dünyanın en iyi sihirbazlarından oluşan “Four Horsemen (Atlılar Çetesi)” ekibinin başından geçenleri konu alıyor. Ekip üstün sihir marifetlerini sadece sahne gösterileri için değil, soygun yaptıkları bankaların sistemlerine erişmek için de kullanırlar. Bu adamlar izleyicileri önce başka bir kıtadaki bir bankayı soyarak, daha sonra beyaz yakalı bir suçlunun bankadaki milyon dolarlarını izleyicilerin banka hesaplarına aktararak şaşırtırlar. Bunun üzerine onları durdurmaya kararlı olan FBI ajanı Dylan Rhodes ve Interpol ajanı Alma Dray birlikte bu çetenin peşine düşerler."
Gözyaşı Ustası,"Romantik, Dram","Yetimhanede zorlu bir çocukluk geçirdikten sonra aynı aile tarafından evlat edinilen Nica ve Rigel, beklenmedik ama karşı koyması güç duygularla birbirine yakınlaşır."
İntikam Vakti,"Aksiyon, Suç, Gerilim","Her hafta Los Angeles'ta zırhlı kamyonlarla yüz milyonlarca dolar taşıyan bir firmanın en yeni üyesi kendini kısaca H olarak tanıtan esrarengiz bir adamdır. Bir soygun sırasında kontrolü ele alıp durumu kolayca çözen H ekip arkadaşlarını şaşırtır. Soygun girişimi karşısında soğukkanlılığı ve silah kullanımında sergilediği ustalık, geçmişine dair kimi soruların sorulmasına yol açar."
Malena,Dram,"Dünya, ülkelerin arasındaki politik çıkmazlar sebebiyle büyük bir savaşın gölgesindedir. Bu dünyada gençliğine ulaşmaya çabalayan bir çocuk ise kasabalarına gelen, güzeller güzeli bir genç kadın olan Malena'nın etkisiyle kendi erkek kimliğini bulmak üzeredir. Malena, tüm güzelliğiyle faşist bir İtalyan kasabasını derinden etkilemektedir. Bütün kasabayı birbirine düşürecek olan genç, seksi ve dul kadın, bu kasabanın hem başlangıcı hem de sonu olmak üzeredir."
Bitirim İkili,"Aksiyon, Komedi, Suç","Dedektif ve Müfettiş Lee, Hong Kong polisine bağlı uzak doğu dövüşleri konusunda rakip tanımayan son derece başarılı bir polis memurudur. Hayatta en çok değer verdiği varlık ABD'ye Çin Konsolosu olarak atanan çok saygı duyduğu bir bürokratın 11 yaşındaki kızı Soo Yung'dur. Soo Yung içinde Lee, en iyi dostu ve koruyucu meleğidir. Fakat, Çin Konsolosu, ABD'ye gidip yeni görevine başladıktan kısa bir süre sonra, Soo Yung kimliği belirsiz kişiler tarafından kaçırılır. Bunun üzerine Lee, Amerika'ya gönderilerek Soo Yung'u bu kişilerin elinden kurtarmakla görevlendirilir. Lee, Amerika'da hiç ummadığı bir durum ile karşılaşır. FBI, LAPD dedektiflerinden biri olan James Carter'ı (C. Tucker) da bu iş için görevlendirmiştir. Carter, sorumsuzluğu, vurdumduymazlığı ile çalıştığı kişiler için bir kabustur. Fakat FBI'ın amacı bir yabancı olan Carter'ı kendi işlerine karıştırmamaktır."
Kül,"Bilim-Kurgu, Korku, Gerilim","Bilim kurgu türündeki bir korku filmi olan Kül'de, uzay istasyonunda çalışan bilim insanı Riya uykudan uyanır ve meslektaşlarının acımasızca öldürüldüğünü fark eder. Ancak kendisi saldırıyla ilgili hiçbir şey hatırlamamaktadır. Onu kurtarması için gönderilen bilim insanı Brion'la birlikte ne olup bittiğini araştırmaya başladıklarında ardı ardına korkunç olaylar yaşanmaya başlanır."
Kasırgalar,"Aksiyon, Gerilim","Fırtına mevsimi yoğunlaştıkça, daha önce hiç görülmemiş korkunç olaylar ortaya çıkar ve Kate, Tyler ve rakip ekipleri, hayatlarının mücadelesini verirken kendilerini Oklahoma'nın merkezinde birleşen çok sayıda fırtınanın tam ortasında bulurlar."
Güzel ve Çirkin,"Romantik, Aile, Animasyon, Fantastik","Tüm zamanların en mükemmel animasyonlarından biri olan Film, ayaklarınızı yerden kesecek!  Kendini esrarengiz bir yaratığa dönüşen prensin şatosunda bulan Belle’in maceralarına göz atın. Belle hayatının en önemli dersini alacak ve asıl güzelliğin insanın içinde olduğunu keşfedecek. Dijital oarak yeniden düzenlenmiş versiyonu herzamankinden daha sihirli! Misafirimiz olun ve müziğin ve sıcacık karakterlerin sizleri hiç olmadığı kadar büyülemesine izin verin."
The Suicide Squad: İntihar Timi,"Aksiyon, Komedi, Macera","Belle Reve, ABD'deki en yüksek ölüm oranına sahip olan hapishanedir. Süper Kötülerin tutulduğu bu yerden kurtulmak için her şey göze alınır. Bloodsport, Peacemaker, Captain Boomerang, Ratcatcher 2, Savant, King Shark, Blackguard, Javelin ve herkesin favori psikopatı Harley Quinn yap ya da öl görevini yerine getirebilmek için bir mahkumlar timi oluşturur. Ekip silahlandırılarak düşmanlarla dolu Corto Maltese adasına bırakılacaktır. Militan düşmanlar ve gerillarla dolu ormanda adım adım ilerleyen ekibe sadece Albay Rick Flag liderlik eder. Her hareketlerini izleyen Amanda Waller'ın teknoloji harikası cihazları ile zorlu bir maceranın içinde olan ekip, herhangi yanlış bir hareketlerinde öldürelecektir."
Arcadian,"Aksiyon, Korku, Gerilim, Bilim-Kurgu","Yakın bir gelecekte, Dünya'daki normal yaşam yok edilmiştir. Paul ve iki oğlu Thomas ve Joseph, gündüzleri sükûnet, geceleri azap içinde bir hayat yaşamaktadırlar. Her gece, güneş battıktan sonra, gizemli ve şiddetli bir kötülüğün amansız saldırılarıyla karşı karşıya kalırlar. Thomas'ın gün batımından önce eve dönmediği bir günde, Paul onu bulmak için güvenli çiftliklerini terk etmek zorunda kalır. Aileyi, hayatta kalmak için umutsuz bir plan yapmaya zorlayan kabus gibi bir savaş başlar."
Terminatör 2: Mahşer Günü,"Aksiyon, Gerilim, Bilim-Kurgu","Sarah Connor'ın Skynet tarafından gelecekten gönderilen Terminator'ın elinden kurtulmasından on yıl kadar sonra, 1995 yılında bu kez T-1000 modeli yeni bir Terminator, insan direnişçilerin gelecekteki lideri ve Sarah'nın oğlu John Connor'ı öldürmek için 2029 yılından gönderilir. Direnişçiler ise 1995 yılına yeniden programladıkları T-800 modeli bir Terminator göndermeyi başarırlar. T-800'ün görevi Sarah'yı akıl hastanesinden kaçırmak ve John'u T-1000'e karşı korumaktır."
Madagaskar,"Aile, Animasyon, Macera, Komedi","Yaşadıkları hayvanat bahçesinde kendi düzenlerini kurmuş dört arkadaş hayatlarından çok mutludurlar. Aslan Kral Alex, Zebra Marty, Zürafa Melman ve Su Aygırı Gloria, şehrin ortasında kendi ormanlarını kurmuşlardır. Normal seyreden hayatları içlerinden birinin mecara arayışı yüzünden değişir. Zebra Marty merak ettiği dış dünyayı keşfetmek uğruna bir gece hayvanat bahçesinden kaçar. Onun yokluğunu fark eden arkadaşları çok sevdikleri dostlarını bulmak için yollara düşerler. Başlarına birbirinden komik olaylar gelen ekip, sonunda kendilerini Madagaskar adasında bulurlar. Ancak alıştıkları rahat düzenden uzak kalmak ve doğal yaşama uyum sağlamak onlar için pek de kolay olmayacaktır."
Meg 2: Çukur,"Aksiyon, Bilim-Kurgu, Korku","Kötü niyetli bir maden operasyonu sebebi ile görevleri tehdit edilen ve zora giren ekibin yolculukları kaosa sürüklenir. Hayatta kalmak için yüksek riskli bir savaşın içine giren araştırma ekibi, zamana karşı nabız gibi atan bir yarışta acımasız yırtıcıları zekâlarıyla alt etmeye ve onları geride bırakmaya çalışır."
Otel Transilvanya: Transformanya,"Animasyon, Komedi, Aile, Macera, Fantastik","Van Helsing, insanların canavarlara dönüşmesine izin veren gizemli icadını mükemmelleştirir. Ancak, Canavarlaştırma Işını çığırından çıkar ve Drac'la canavar arkadaşlarının hepsi insana dönüşür. Johnny ise bir canavara dönüşür. Yeni uyumsuz bedenlerine uyum sağlamaya çalışırlar. Drac, güçlerinden sıyrılmış, bir baba gövdesine sahip şekilde sabah sporu yapmaya başlar. Hayatı bir canavar gibi sevmeye başlayan coşkulu damadı Johnny'le, çok geç olmadan bir tedavi bulmak için bir araya gelmeli ve dünya çapında mücadele göstermelidir. Mavis'in ve insan Drac Pack'in yardımıyla, dönüşümleri kalıcı hale gelmeden önce kendilerini geri döndürmenin bir yolunu arıyorlar."
Aladdin,"Macera, Fantastik, Romantik, Aile","Aladdin, zamanını Agrabah şehrinde pazardan yiyecek çalarak geçiren fakir bir gençtir. Gecelerini, şehrin farklı bölgelerinde uyuyarak geçirirken, gündüzlerini ise hırsızlığa ayırmaktadır. Ancak yaşam tarzına rağmen aslında Aladdin'in altın gibi bir kalbi vardır. Onun macerası, tuhaf babası tarafından zorla evlendirilmeye çalışılan bir genç kızla tanıştığı zaman başlar. Bu genç kız aslında ülkenin sultanının kızı olan Prenses Jasmine'dir. Aladdin'in şansı, Harikalar Mağarası'ndan sihirli bir lamba aldığında aniden değişir. Bilmeden aldığı bu lambada, eğlenceye düşkün, neşeli ve 3 dileğini gerçekleştirme şansına sahip olan bir cin vardır. Aladdin'in lambanın cini sayesinde sevdiği kıza ulaşmaya çalışırken bilmediği şey ise Sultan'ın danışmanı Jafar'ın hem Aladdin hem de lamba için kendi planları olduğudur..."
Komşum Totoro,"Fantastik, Animasyon, Aile","İki sevimli kız kardeş olan Satsuke ve Mei, babaları ile birlikte hastanede yatan annelerine daha yakın olabilmek için hastanenin yakınındaki bir köy evine taşınırlar. Yeni evlerine alışmaya çalışırlarken inanılmaz bir gerçeğin farkına varırlar. Evlerinin yakınındaki ormanda Totoro isminde, son derece sevimli ve büyülü yaratıklar yaşamaktadır. Bu sevimli yaratıklarla kısa zamanda arkadaş olan Satsuke ve Mei için şehrin telaşından uzakta yepyeni büyülü bir dünyanın kapıları açılacaktır. Yaz zamanının kaygısızlığı üzerine kurulmuş bir aile filmi olarak tasarlanan Komşum Totoro ile Miyazaki'nin unutulmaz karakterleriyle zenginleştirilmiş hayalgücü ve arkadaşlığın bir masalını yaratıyor. Çocukluğun perimasalı dünyasının ve yokolan kırsal alanların yasını tutuyor..."
Alis Harikalar Diyarında,"Aile, Fantastik, Macera","17 yaşındaki Alice Kingsleigh, sosyeteye tanıtım partisinde kendisini rahatsız hisseder ve beyaz bir tavşanı takip ederek Harikalar Diyarı'na girer. Burada ilginç ve tuhaf yaratıklarla dolu bir dünyada eski dostlarıyla yeniden karşılaşır. Alice, Harikalar Diyarı'nın zalim Kırmızı Kraliçe tarafından yönetildiğini keşfeder ve bu dünyayı kurtarmak için bir kehaneti yerine getirmesi gerektiğini öğrenir."
Kolombiyalı: İntikam Meleği,"Aksiyon, Gerilim, Suç, Dram","Yıl 1992. Yer Kolombiya. 9 yaşındaki Cataleya anne babasının katledilişine seyirci olur ve kendisi de katledilmekten kılpayı kurtulur. Bir gangter olan amcası Emilio ile Amerika Birleşik Devletleri'ne sığınır. Bundan onbeş yıl sonra, bir kiralık katil olarak amcası için çalışacak ve geride hep anne babasının katilleri için bir kartvizit bırakacaktır: Her kurbanın göğsüne çizdiği bir orkide. Çünkü Cataleya, intikamını sonuna dek almaya yeminlidir. Sevdiği herşeyi de bu uğurda kaybetmeye hazırdır."
Holland,"Gerilim, Gizem","Bu baş döndürücü gerilim filminde Nicole Kidman, mükemmeliyetçi Nancy Vandergroot rolünde. Öğretmen ve ev kadını Nancy'nin, lale tarlalarıyla ünlü Michigan, Holland'da kocası ve oğluyla sürdürdüğü kusursuz yaşamı, çarpık bir hikâyeye dönüşür. Nancy ve cana yakın meslektaşı bir sırrın izini sürmeye başladıklarında hayatlarındaki hiçbir şeyin göründüğü gibi olmadığını fark ederler."
Kim Demiş Kötüyüz Diye? - Hayaletli Soygun,"Animasyon, Komedi","Kurnaz Kötüler çetesi, ürkütücü bir malikaneden paha biçilmez bir madalyon çalmak için çok riskli bir Cadılar Bayramı soygununa girişir."
Ejderhalar Kitabı,"Fantastik, Animasyon, Aksiyon, Komedi, Aile","Filmdeki ejderhalar hakkında kitabi bilgilere yer verilmiş( Ejderhalar 4'e ayrılır, birincisi ateş grubu ikincisi.....vs. gibi), belkide yeni bölümde fazlaca görünecekler hakkında bilgi sahibi etmeye çalışmış izleyecekleri. 17 dk Kısa metrajdır."
Görevimiz Tehlike II,"Macera, Aksiyon, Gerilim","Eski bir IMF ajanı olan Sean Ambrose, Chimera adlı ölümcül bir virüsü ele geçirmeye çalışmaktadır. Virüsü ve antivirüsünü kullanarak borsayı kontrolüne alarak bir servet yapmak isteyen Ambrose'un peşine Ethan Hunt düşer. Ethan, Ambrose'u bulabilmek için onun eski sevgilisi Nyah Hall'u kullanmaya karar verir. Ancak Nyah'ın büyüleyici güzelliği, Ethan'ın ona aşık olmasına ve önceliklerinin değişmesine sebep olur."
