film_title,category,plot
Yarının Sınırında,"Aksiyon, Bilim-Kurgu","Yakın gelecekte dünyayı ele geçiren Mimics adlı uzaylı birliği, birçok büyük şehri yok eder ve milyonlarca insanı ölümün eşiğinde bekletir. Dünyada hiçbir ordu, onların hızına, silahlarının gücüne ve de en önemlisi telepati yoluyla emir verme ve uygulama güçlerine ulaşamaz. Artık dünyadaki tüm ordular bu uzaylı sürüsüne karşı güçlerini birleştirmek durumundadır.Subay Bill Cage daha önce bu savaşlardan hiçbirine katılmamış tecrübesiz bir askerdir ve atıldığı yeni görevi onun için bir nevi intihar anlamına gelmektedir. Beklenen olur; Cage dakikalar içerisinde öldürülür... Fakat bu bir sonu değil, yeni bir başlangıcı doğurur. Cage, sıradışı bir şekilde cehennem gibi bir günde uyanır, kendini kırılması zor bir döngünün içerisinde bulur."
Ant-Man ve Wasp: Quantumania,"Aksiyon, Macera, Bilim-Kurgu","Ant-Man serisinin bu üçüncü bölümünde Scott ve Hope'un birlikte geçirdiği zamanın yanı sıra, Scott'ın kızı Cassie'nin de önemli bir rol oynadığı bir hikâye sunar. Cassie, kuantum alanıyla ilgili araştırmalar yaparken, yanlışlıkla bir portal açar ve bu durum onları kuantum dünyasına çeker. Kuantum Alanı'nın derinliklerinde, hem tanıdık hem de yeni tehlikelerle karşılaşırlar. Bu yolculuk sırasında, Kang the Conqueror adında güçlü bir düşmanla tanışırlar. Kang, zaman yolculuğu yetenekleriyle bilinen karmaşık bir karakterdir ve evrenin kontrolünü ele geçirme planları yapmaktadır. Ant-Man ve Wasp, Kang'ın planlarını durdurmak için birlikte çalışmak zorundadırlar, ancak bu süreçte birçok zorlukla yüzleşirler."
Yetenekli Genç Kadın,"Gerilim, Suç, Dram","Film, gelecek vaat ettiği konusunda herkesin hemfikir olduğu ancak acıklı bir olay sonucu geleceği mahvolan Cassandra ""Cassie""’ Thomas'a odaklanıyor. Tıp fakültesini bırakmak zorunda kalan Cassie, evhamlı ebeveynleriyle birlikte yaşamakta ve bir kahve dükkanında çalışmaktadır. Dışarıdan hayatı durma noktasına gelmiş gibi görünen Cassie ise ikili bir hayat yaşamakta ve geceleri yolunun kesiştiği erkeklerden intikam almaktadır."
SpongeBob Squarepants: Kreepaway Kamp,"TV film, Aile, Komedi, Korku, Animasyon","Yeniden bir araya gelmek için Koral Kampına giden Sünger Bob ve arkadaşları, gölgelerin arasında gizlenen gizemli bir figür tarafından takip edilirken, kampçılar birer birer kaybolmaya başlar."
Godzilla vs. Kong,"Aksiyon, Bilim-Kurgu, Macera","Ezelî bir düşmanlık iki efsanevi yaratığı karşı karşıya getirirken bilinmeyen bölgelere yapılan bir keşif görevi, Titanların kökenlerine ilişkin gizemleri açığa çıkarır."
"Ben, Kendim ve Sevgilim",Komedi,Charlie Rhode Island'da bir eyalet polisidir. Biraz çatlak bir karakterdir. öteyandan kibar ağırbaşlı ve kimse ona bulaşmadıktan sonra kimseye sorun çıkarmayan biridir. Fakat bir süre sonra manyak olan öbür yanı üstün gelir. Bu sırada Charlie'ye bir kaçak olduğu öne sürülen Irene'yi yakalayıp tekrar New York'a getirmesi söylenir. Irene rüşvet alan polisler sayesinde kaçmıştır. Irene'nin kaçışı çok kolay almaktadır. Ta ki en umulmadık zamanlarda Hank karşılarına çıkıncaya kadar...
Çıplak Silah: Polis Dosyalarından,"Komedi, Suç","Teğmen Frank Drebin, Los Angeles Polise Teşkilatı'na bağlı bir birimde çalışan sakar bir dedektiftir. En yakın arkadaşı ve ortağı Dedektif Nordberg bir operasyon sırasında vurulunca tatilini yarıda bırakıp Los Angeles'a döner. Araştırması sırasında olayın Vincent Ludwig isimli bir iş adamının planını keşfeder. Ludwig, bir beyzbol oyuncusunun beynini yıkamayı ve Kraliçe Elizabeth'i Los Angeles gezisi sırasında öldürmeyi planlamaktadır. Sakar dedektifimizin ortalığı karıştırması pek uzun sürmez.Leslie Nielsen'ın unutulmaz karakter Frank Drebin'i canlandırdığı Çıplak Silah serisinin ilk filmi."
Insomnia,"Gerilim, Suç, Dram","Will Dormer, Los Angeles Polis Departmanında çalışan deneyimli bir polistir. Ortağı Hap ile birlikte Alaska'nın küçük bir kasabasına genç bir kızın öldürülmesini araştırmak için gidecektir. Gittiği bölgenin bitip tükenmeden parıldayan güneş ışığından muzdarip Dormer ve Hap cinayetin en güçlü şüphelisi münzevi bir yazar olan Walter Finch'in peşindedir. Kumsalda sisli bir günde gerilimli bir kovalamaca içindelerken Finch Dormer'in ellerinden kurtulup kaçar. Sislerin içinde kaybolduğunda ise bir silah sesi duyulur. Hap öldürülmüştür... Bir polis olarak duyduğu sorumluluk ve ortağının öldürülmesinden kendisini suçlu bulması Dormer'ı Finch ile psikolojik bir kedi fare oyunu oynamaya sürükleyecektir. Finch ve Dormer'ın arasındaki bu kovalamaca yerel polisi de Finch'e karşı harekete geçirmiştir."
Lucy Shimmers and the Prince of Peace,"Dram, Aile","Lucy, zatürre nedeniyle hastaneye kaldırılan ve durumu giderek kötüleşen beş yaşında bir kızdır ve yolu Edgar isimli bir suçluyla kesişir. Fakat Lucy'nin özel bir yeteneği vardır. Ölmüş dedesi Jackson’ı görebilmekte ve onunla konuşabilmektedir. Jackson, Lucy'e bir melek olduğunu ve bir görevi olduğunu iletir. Lucy'nin görevinin Edgar'ın kalbini yumuşatmak ve Tanrı'ya yaklaştırmak olduğunu söyler. Edgar ise hapisten yeni çıkmış, sert ve acımasız biridir."
Felaketler Dizisi: Skandalların Başkanı,Belgesel,"Rob Ford, Toronto'nun gözü kara ama sevilen belediye başkanı olarak Kanada siyasetinde skandal yarattı. Derken kokain içerken çekilmiş bir videosu onun düşüşünü hazırladı."
Yarın Yokmuş Gibi,"Komedi, Romantik, Bilim-Kurgu","Vurdumduymaz bir insan olan Nyles ve nedime olmaya isteksiz Sarah'ın yolu, Palm Springs'te bir düğünde kesişir. İkilinin arasında romantik anlar yaşanır. Ancak Sarah, Palm Springs'ten ne zaman ayrılmaya çalışsa kendini yeniden aynı yerde bulur. Sarah ve Nyles, birbirlerinden ve bulundukları yerden kurtulmak için ellerinden geleni yapacaklardır."
Proje X,Komedi,"3 çılgın lise öğrencisi, kaybeden hallerinden kurtulmak ve ""biraz"" eğlenmek için büyük bir doğum günü partisi düzenlerler. Fakat gece ilerledikçe yüzlerce kişi partiye akın edecek ve işler çığırından çıkacaktır ve bu arada gündüzden beri kayıtta olan kamerayı da ellerinden düşürmeyeceklerdir."
Godzilla II: Canavarlar Kralı,"Bilim-Kurgu, Aksiyon","2014 yapımı Godzilla'nın devamı niteliğinde olan filmde, kripto-zoolojik bir kuruluş olan Monarch dünyanın çeşitli yerlerinde buldukları kadim yaratıkları izlemeye devam etmektedir. Ancak hükümetler 2014 yılında ki olaydan sonra bu kadim yaratıkların tamamen yok edilmesini istemektedir. Efsane oldukları düşünülen bu kadim süper türler bir anda tekrar uyanır ve birbirlerine üstünlük kurmak için savaşmaya başlar. Bu savaş insanlığı yok olmanın eşiğine getirecektir."
Av 2,"Bilim-Kurgu, Aksiyon, Gerilim","Teğmen Harrigan uyuşturucuya karşı savaş açmış bir polistir. Birdenbire uyuşturucu lordları birer birer vahşice öldürülmeye başlar. Üstleri, ona bu olaydan uzak durmasını söylese de Harrigan, olayı derinlemesine araştırmaya başlar. Kısa süre sonra cinayetlerin arkasında, kurbanlarını hunharca avlayarak kafataslarını ganimet olarak saklayan uzaylı bir avcının olduğunu anlar. Harrigan artık ya bu vahşi yaratığı durduracaktır ya da avın bir parçası olacaktır."
Queer,"Dram, Romantik","1940 yıllarında Meksika'da geçen film, New Orleans'taki bir uyuşturucu baskınından kaçan Lee'yi takip ediyor. Mexico City'de şehrin kulüplerinde dolaşan Lee, terhis edilmiş bir Amerikan Donanması askeri olan uyuşturucu kullanıcısı Allerton'a aşık olur."
Lolita,"Dram, Romantik","Üniversitede ders vermek için Amerika'ya yerleşen İngiliz Profesör Humbert Humbert 13 yaşında kızı Dolores'le birlikte yaşayan dul Charlotte'un yanında bir oda kiralar. Humbert, Lolita adını takacağı Dolores'e açıklanamaz bir tutku duymaya başlar. Yasak aşkına daha yakın olabilmek için, hiç sevmediği halde Charlotte'la evlenecek kadar ileri gider. Carlotte inanılmaz gerçeği keşfetmesinin ardından kaza sonucu ölünce, Lolita'ya hiç bir şey söylemeyen Humbert onu da yanına alarak arabayla yollara düşer. Humbert'in giderek daha da tehlikeli sularda yüzerken aklıselimi de yitirmeye başlayacaktır."
Zafere Hücum,"Dram, Aksiyon","1976 yılında gerçekleşen Alman Grand Prix yarışında Niki Lauda'nın kullandığı Ferrari ikinci round'un sonunda yaşadığı bir sorun nedeniyle yarış dışı kalır ve birincilik ezeli rakibi James Hunt'a gider. Bu kaza sonrasında Lauda yaralanır; aradan geçen altı haftanın ardından olağan hırsı ve öfkesiyle pistlere geri döner. İki yarışçı arasında italyan Grand Prix'i ile başlayan mücadele diğer yarışlarda katlanarak devam eder. Hedef dünya şampiyonluğudur...  Avusturyalı F1 yarışcısı Niki Lauda ve İngiliz rakibi James Hunt arasındaki dillere destan rekabeti konu alan film, Formula 1'in altın döneminde, 1970'lerde geçiyor."
Noel Gecesi Kabusu,"Fantastik, Animasyon, Aile","Balkabağı Kral Jack Skellington, Halloweentown'ı yönetmektedir. Kabuslardan fırlamış bir kasabayı andıran Halloweentown, cinler, ruhlar ve yarasalardan oluşan bir nüfusa sahiptir. Jack, bir gün Christmastown'a bir ziyaret yapar ve orada gördüklerini kıskanarak kendi şehrini de oraya benzetmek için Santa Claus'u kaçırır. Santa'nın yerine geçen Jack, çocuklara kendince alternatif hediyeler dağıtmaya başlar. Çılgın dahi Tim Burton'ın konseptini yarattığı ve yapımcılığını üstlendiği film, en iyi özel efekt dalında Oscar'a aday olmuştu..."
Don't Look Up,"Komedi, Bilim-Kurgu","İki astronom, Dünya'yı yok edecek bir kuyruklu yıldızın yaklaşmakta olduğu konusunda insanlığı uyarmak için bir medya turuna çıkar, ancak hiç kimse onları umursamaz."
9 Songs,"Dram, Müzik, Romantik",Biri İngiliz biri Amerikalı iki sevgilinin 1 sene boyunca yaşadıkları müzik ve cinsellik ile dolu yoğun ilişkileri.
Mükemmel Günler,Dram,"Tokyo’nun umumi tuvaletlerini temizleyen Hirayama, bir yandan müzik, edebiyat ve fotoğraf tutkusunun peşinden gittiği hayatından memnundur. Geçmişiyle yeniden bağ kurmasına yol açan beklenmedik karşılaşmalar, hayatının düzenini yavaş yavaş bozmaya başlar."
Küçük Deniz Kızı Ponyo,"Animasyon, Fantastik, Aile","Okyanus kralının kızı olan Ponyo, sıradan bir balık değildir. Denizin tüm sihri emrine amadedir. Ponyo, yaşadığı denize yakın bir yerde oturan beş yaşındaki Sosuke ile arkadaş olduğunda aralarında özel bir bağ oluşur ve Ponyo insan olmak ister. Sosuke ile arkadaşlığını karada da sürdürmek isteyen Ponyo, hayallerini gerçekleştirir ama bu sefer de doğanın dengesiyle oynamış olur. Bu dengeyi yeniden sağlamak için büyük fedakarlıklar yapması gerekecektir."
Su Perisi,Dram,"Gençlik ve Muhteşem Güzellik filmlerinin yönetmeni Paolo Sorrentino, doğduğu şehre yeni bir aşk mektubuyla geri dönüyor: içten ve sevecen Tanrının Eli (2021) filminin de geçtiği canlı, hareketli, bağıran, gülen, büyüleyen, göz alıcı Napoli. Prömiyerini Cannes’da yapan Parthenope, adını sonradan Napoli’nin tanrısı haline gelen efsanevi sirenden alıyor ve güzeller güzeli Parthenope’nin 1950’deki doğumundan günümüze, çalkantılı yaşam yolculuğunu anlatıyor. Kahramanlıkla değil ama özgür bir ruhla sarmalanmış, Napoli’ye ve aşkın bin bir yüzüne (gerçek, anlamsız ve tarifsiz aşklara) karşı amansız bir tutkuyla dolup taşan kadınsı bir destan."
Karışık Aile,"Komedi, Romantik","“Karışık Aile - Blended”, yıldız oyuncular Adam Sandler ve Drew Barrymore’u romantik komedileri “50 İlk Öpücük - 50 First Dates” ve “Düğün Şarkıcısı - The Wedding Singer”dan sonra, bir kez daha bir araya getiren, üçüncü komedi filmi. Kötü bir buluşmadan sonra bekar anne ve baba olan Lauren (Drew Barrymore) ve Jim (Adam Sandler) ortak tek bir karara varmışlardır, bir daha görüşmeyeceklerdir. Ancak kader yinede onları bir araya getirir. Safariye birbirlerinden habersiz aileleriyle aynı zamanda giden ikili, lüks bir suit odayı paylaşmak durumunda kalırlar. Birbirlerine dayanmak ve olayları akışına bırakmak durumundadırlar.."
İtaatsizlik,"Dram, Romantik","Esti, haham olan babasının ölümünün ardından Ortodoks Yahudi olan ailesinin evine geri döner. Ancak kendine kurduğu hayat ile ailesinin ve çevresinin inançları artık farklıdır. Esti tekrar gördüğü çocukluk arkadaşına ilgi duymaya başladığında bu inanç çakışması su yüzüne çıkacaktır."
Kanca,"Macera, Fantastik, Komedi, Aile","Peter Banning, işkolik bir avukattır. Karısı ve iki çocuğunu fazlasıyla ihmal etmektedir. Ailece İngiltere'deki büyükanne Wendy'i ziyarete gittiklerinde, çocukları Kaptan Hook tarafından kaçırılır. Peter, peri Tinkerbell'in yardımıyla Olmayan Ülke'ye döner. Peter Banning, artık Peter Pan olmuştur ve Kayıp Çocuklar'ın da yardımıyla çocukluk anılarını ve uçmayı hatırlayacak ve Kaptan Hook ile savaşacaktır."
Notre Dame'ın Kamburu,"Dram, Animasyon, Aile","15. Yüzyıl Paris'inde yaşayan bir kukla ustası, Notre Dame kilisesinin çan çalıcısı, kambur ama altın kalpli ve mutsuz Quasimodo'nun hikayesini anlatıyor. Paris'in adaletinden sorumlu katedral onu kiliseye alarak hem dış dünyaya kapatmıştır hem de hizmetçi gibi kullanıyordur. Kasabaya gelen bir çingene topluluğuyla ortalık daha da şenleniyor ve Quasimodo çingene güzeli Esmeralda'ya aşık oluyor. Ama Katedral'in gözüde Esmeralda'dadır..."
Amelie,"Komedi, Romantik","Paris'te garsonluk yaparak, kendine özgü bir dünyada yaşayan saf, çekingen ve masum bir kızdır Amelie. Annesinin beklenmedik ölümü, babasının soğuk tavırları ve yaşadığı travmalar sonucu, sevimli ve boş şeylerle uğraşarak kendisine eğlence yaratmaya çalışsa da aslında hayatı sıkıcı bulduğu için kendisini son derece yalnız hissetmektedir. Bu kısır döngü Amelie’nin evde bulduğu bir kutuyu ve onun aracılığıyla sahibini keşfetmesiyle birlikte bir anda bıçak gibi kesiliverir... Amelie aşık olmuştur."
Karabasan,"Korku, Gerilim","Yüzyıllar boyunca ve kültürler arasında, ebeveynler çocuklarını, masum çocukları kaçırıp onları iğrenç, çürüyen torbasına tıkıştıran ve bir daha asla görülmeyen efsanevi Bagman hakkında uyardılar. Patrick McKee, çocukken böyle bir karşılaşmadan kıl payı kurtuldu ve bu, yetişkinliği boyunca onda kalıcı izler bıraktı. Şimdi, Patrick'in çocukluk işkencecisi geri döndü ve karısı Karina ile oğlu Jake'in güvenliğini tehdit ediyor."
Chappie,"Suç, Aksiyon, Bilim-Kurgu","Yakın bir gelecekte geçen filmde robotlardan oluşan bir polis ordusu, insanların güvenliğini sağlamakla görevlendirilmiştir. Ancak bu robotlardan bir tanesi olan Chappie bir gün kaçırılır ve yeniden programlanır. Bu andan itibaren dünyanın ilk düşünebilen ve hissedebilen robotu olan Chappie, artık otoriteler için bir tehdit olarak algılanmaya başlamıştır ve bir an önce yok edilmesi gerekecektir. Bilimkurgu ve komedi türlerindeki filmin yönetmeni, 'District 9' ile bilimkurgu türüne bambaşka bir boyut kazandırdıktan sonra 'Elysium' filmiyle izleyici karşısına çıkan Neill Blomkamp."
Suç Takımı,"Aksiyon, Suç, Gerilim","Merkez Bankası her gün 120 milyon dolar nakit parayı dolaşımdan alıp imha etmektedir. Şehrin en başarılı silahlı soygun çetesi de Los Angeles'ın ünlü bankasının günlük olarak imha ettiği bu paraları almak için imkansız bir soygun planına girişir. Ancak farklı yeteneklerle donanmış olan bu elit ekibin işi planladıklarından daha zor olacaktır. Zira Los Angeles Şerif Bürosu'nun deneyimli ve cesur elemanları, hırsız çetesinin tam karşısında durmaktadır."
Minyonlar 2: Gru'nun Yükselişi,"Aile, Komedi, Macera, Animasyon","Gru, henüz daha 12 yaşında bir çocukken, yani kötülüklerin ustası olmamışken, yaşadığı bodrumdan bütün dünyaya hakim olma hayallerini kurar. Yüreklere korku salan haydutların oluşturduğu Hırçın Altılılar çetesi lidelerini ekipten atınca, Gru onlara katılmaya çalışır. Ancak kısa sürede kötülüklerin can düşmanı haline gelir. Gru kaçış yolunda başının çaresine bakmak için uğraşırken, Minyonlar da onu kurtarmak için bir yeni kavga sporu öğrenmek için kolları sıvar. Ve Gru da en kötülerin bile dostlarının yardımına muhtaç olduklarını görür."
İtiraf 2,"Dram, Gizem","Joe, Seligman'a bir nemfoman olarak hayatının hikayesini anlatmaya devam ediyor. Bu kez yetişkinlik yıllarına odaklanır; ihmalkâr bir anne oluşunu, sadomazoşizmle ilişkisini ve vahşice dövülmesine neden olan durumu anlatır. Bu arada Seligman Joe'ya açılmaya başlar."
Teklif,"Komedi, Romantik, Dram","Kitap editörü Margaret sınır dışı edilerek ülkesi Kanada’ya gönderilmesi gündeme gelince hemen aklını çalıştırır ve yıllardır çile çektirdiği ezik asistanı Andrew ile nişanlı olduğunu hükümet yetkililerine bildirir. Ancak asistanı bu yalana ortak olmak için kendince bazı koşullar öne sürer. Zoraki çiftimiz, damat adayının ailesiyle tanışmak için Alaska’nın yolunu tutmak zorunda da kalacaktır. Büyük şehirde daima kontrollü bir kadın olan Margaret, orada karşılaşacağı birbirinden komik durumlar karşısında sudan çıkmış balığa döner."
Grinç,"Aile, Komedi, Animasyon, Fantastik","Who köyünden ayrılarak dağın başında, kimsenin yaklaşmaya cesaret edemediği mağarasında yaşayan Grinch'e yalnızca sadık köpeği Max eşlik etmektedir. Günlük yaşamın sükunetinden memnun olan Grinch'in kabusu ise, yılbaşı kutlamalarına aşırı düşkün olan Who halkının yıl sonu başlayan coşkusudur. Bu yıl kutlamaların daha da coşkulu olacağının ilan edilmesi sonucu, Grinch bu coşkuyu yok etmek adına, Noel Baba kılığına girerek yılbaşını çalmaya karar verir. O sırada köyde yaşamakta olan küçük Cindy-Lou ise arkadaşlarıyla birlikte yılbaşında Noel Baba'yı yakalayıp, annesine yaptığı yardımlar için teşekkür etme planı yapmaktadır. İkilinin yılbaşı planları birbirlerini nasıl etkileyecektir?"
Bitirim İkili 2,"Aksiyon, Komedi, Suç","Geçen sefer Los Angeles'ı neredeyse yok ediyorlardı. Şimdi sıra Çin'de.  Hong Kong'da biraraya gelen gözü kara polisler, güzel bir tatilin özlemini çekmektedirler. Fakat Amerikan Elçiliği'nde patlayan bir bombadan sonra bu hayalleri suya düşer. Bir anda kendilerini izini sürmesi zor şüphelilerin peşinde bulan ikilinin yolu güzel bir suikastçi ve gizemli bir çete lideri ile kesişir. Baş döndüren aksiyonu ve mide krampları geçirmenize sebep olacak kadar komik yıldızları evinize geliyor."
Kefenler,"Bilim-Kurgu, Dram, Korku, Gerilim","Karısının ölümünden beri bir türlü teselli bulamayan Karsh, devrim niteliğinde ve tartışmalı bir teknoloji olan GraveTech’i icat eder. Bu teknoloji sayesinde geride kalanlar, kaybettiklerinin cesetlerini kefenleri içinde gözlemleyebileceklerdir. Bir gece, aralarında Karsh’ın eşininkinin de bulunduğu birçok mezar tahrip edilir. Karsh bu eylemin faillerinin izini sürmek için yola koyulur, ancak daha büyük, daha sinsi bir komplonun şüphesi de içini kemirmektedir."
Müfreze,"Dram, Savaş, Aksiyon","Chris Taylor, genç ve idealist bir Amerikalı'dır, ve çok geçmeden Vietnam'da sadece Viet Cong'larda değil, aynı zamanda içinde büyüyen korku, fiziksel bitkinlik ve gitgide artan kızgınlığıyla da savaşmak zorunda olduğunu anlar. Taylor'ın iki kumanda komutanı düşman ve kendi aralarındaki iki savaş net bir çizgi çizmektedir, ama çelişkiler, kaos ve nefret Taylor'ın içine işler, inançlarını boğar ve duyularını insanın en yüksek tuttuğu değer olan hayata karşı hissizleştirir..."
Anastasia,"Animasyon, Aile, Fantastik, Macera","Anastasia , Walt Disney'in çizgi film piyasasındaki 60 yıllık iktidarını sarsarak yüz milyonlarca dolarlık pazara ortak olmak isteyen 20th Century Fox'un ilk uzun metrajlı çizgi filmi. Yine Disney'den transfer ettiği bir ekiple kolları sıvayan Fox, yılların formülünü son teknolojiyle birleştirerek keyifli ve akıcı bir film çıkarmış ortaya. Yetişkinlere özgün bir hikayeyi, kayıp Rus Prensesi Anastasia'nın gizem dolu ünlü öyküsünü anlatan film, başarılı seslendirme çalışması ve müzikleriyle öne çıkıyor. İlerleyen dakikalardan sonra fantazi dünyasına kayarak öyküsünü anlatan film, Rasputin adlı kötü adam portresi, onun yardakçısı sevimli yarasa gibi tiplemeleriyle eğlendirici anlar yaşatıyor. Anastasia, ünvan ve paranın aslında hiç bir şey ifade etmediğini ve sevginin asıl olduğunu vurgulayan 'iyimser' sonuyla sizi bekliyor."
Narnia Günlükleri: Prens Kaspiyan,"Macera, Aile, Fantastik","Narnia’nın büyülü dünyasında zaman bizim dünyamızdan daha hızlı akmaktadır. Bu nedenle tren istasyonundan hareket eden Pevensey kardeşler kendilerini bir sonraki durak olan Büyücü Kral Miraz’ın hüküm sürdüğü adada bulurlar. Şeytani ruhlu bu kralı devirebilmek ve Narnia’nın güzel günlerini geri getirebilmek için adanın genç prensi Caspian ile birlikte güçlü Aslan’la ittifak yaparlar.C.S. Lewis’in aynı adlı fantastik çocuk romanından uyarlanan “The Chronicles of Narnia: The Lion, the Witch and the Wardrobe” (Narnia Günlükleri: Aslan, Cadı ve Dolap), tüm dünyada olduğu gibi Türkiye sinemalarında da olay yaratmış, bir elbise dolabının arkasında gizlenen Narnia ülkesinin göz kamaştırıcı güzellikleri, çocuklar kadar yetişkinleri de büyülemişti. Macera devam ediyor ve devam edeceğe benziyor."
Jack Reacher: Asla Geri Dönme,"Aksiyon, Dram, Gerilim, Suç","Reacher, binbaşının isteği üzerine eski üssüne geri gelir. Ancak Reacher geri döndüğünde eski binbaşının vatan hainliğiyle suçlandığını öğrenir. Reacher, binbaşı Susan Turner'a kurulan komployu ortaya çıkarmak için cinayetin gerçek suçlularının suçluların peşine düşer. Binbaşının adını temizlemek için büyük bir hükümet komplosu arkasındaki gerçeği açığa çıkarmak zorunda kalacak olan Reacher, kanundan kaçarken hayatını sonsuza dek değiştirecek olan büyük bir sırrı da açığa çıkartmaya çalışır."
Zodiac,"Suç, Dram, Gizem, Gerilim","Zodiac, San Fransisco körfez bölgesini dehşete boğmuş ve onlarca yıl boyunca şifreleri ve mektuplarıyla dört ayrı yargı bölgesinin yetkilileriyle alay etmiş bir seri katilin gerçek hikâyesine dayanan bir gerilim filmi. Bir avcıyı avlamak dört adam için bir saplantı hâlini alır; bu öyle bir saplantıdır ki onları eski hâllerinin birer hayaletine dönüştürür, yaşamları katilin bıraktığı sonu gelmeyen ipuçlarıyla bir kurulup bir yıkılır."
Matrix Revolutions,"Macera, Aksiyon, Gerilim, Bilim-Kurgu","Neo, başka bir cephede savaşı bitirmek için savaşırken aynı zamanda Ajan Smith'e karşı koyar. İnsan şehri Zion, makinelerin kitlesel istilasına karşı kendini savunur."
Muhteşem Gatsby,"Dram, Romantik","Yazar olma basamaklarını tırmanan Nick Carraway 1920'lerde eğlence hayatının gözdesi konumuna yükselen New York'a gelir. Kendi Amerikan rüyasının peşindeyken tesadüfen milyoner Jay Gatsby ve onun çevresiyle yolları kesişir. Carraway'nin alkolün su gibi aktığı, göz kamaştırıcı partilerle tanışması fazla zaman almaz. Öte yandan bu büyülü Amerikan rüyasının çöküşü de yaklaşmaktadır. Dışarıdan görkemli görünen bu hayatın örtbas etmeye çalıştığı gerçekler su yüzüne çıkacaktır..."
Yıldız Savaşları: İmparator'un Dönüşü,"Macera, Aksiyon, Bilim-Kurgu","Yıldız Savaşları: İmparator'un Dönüşü'nde iyiyle kötü arasındaki çatışmayı ilk defa dijital ortamda keşfedin. Ölüm Yıldızı'nın yok edilmesinden sonra İmparatorluk güçleri Asileri kovalamaya devam eder. Asi güçlerin buz gezegen Hoth'taki mağlubiyetinin ardından Luke, Cumhuriyet'in düşmesinden beri Dagobah gezegeninde gizlenen Jedi ustası Yoda ile çalışmak için yola çıkar. Luke'yi karanlık tarafa döndürmeye çabalarken Darth Vader onu Bespin'in Bulut Şehri'nde tuzağa düşürür."
Cinayet Günlüğü,"Suç, Dram, Gerilim","Askeri diktatörlük ile yönetilen, soğuk savaşın son yıllarının yaşandığı Güney Kore'de halk, sürekli olarak tatbikatlar ve Kuzey Kore tehdidi ile korkutulmakta, rejimin baskısı protestolara ve isyanlara neden olmaktadır. Bu esnada, Seul'e yakın bir kasabada,  cinayetler işlenmeye başlanır. Kadınlar bağlanarak öldürülmekte, tecavüze uğramaktadırlar. İlk başlarda, yerel bir dedektif olan Park Doo-Man olayı kendi yöntemleri ile çözmeye çalışır. Olayı çözmekte yetersiz kalınca, Seul'dan mektepli bir dedektif Seo Tae-Yoon da ekibe katılır. Tae-Yoon modern yöntemler ve analizler ile olayı çözmeye çalışırken, cinayetler devam edecek, polis teşkilatı yetersiz kalacak ve kasabada kargaşa artacaktır."
